0;Model-Driven Digital Twin Construction: Synthesizing the Integration of Cyber-Physical Systems with Their Information Systems;;class diagram;structure;;;;tagging model, Class Diagram, MontiArc Model;extended MontiArc Model;;I  Accommodation and Food Service Activities;Implement;Individual Systems, such as automated cars (Atorf and Roßmann, 2018), gas turbines (Dawes et al., 2019), or manufacturing machines (Debroy et al., 2017).;As-Designed;;;;;Daniel;;;Model to Model Transformation;;;;;extend CPS and DTIS by the necessary communication and synchronization infrastructure;;DTs are digital representations of cyber-physical assets or processes that enable advanced control, decision making, and optimization. They are used in a variety of domains, including avionics, automotive, and smart manufacturing;UTOMATIC FIRE EXTINGUISHING SYSTEM;;;;;
1;Model-Driven Digital Twin Construction: Synthesizing the Integration of Cyber-Physical Systems with Their Information Systems;;montiarc;;;;;MontiArc model;GPL code for CPS;;;;;;;;;;Daniel;;;code generation;;;;;generate CPS code;;;;;;;;
2;Model-Driven Digital Twin Construction: Synthesizing the Integration of Cyber-Physical Systems with Their Information Systems;;tagging model;NOTE-DL: hier brauchen wir noch eine klare Abtrennung;;;;class diagram;digital twin information system;;;;;;;;;;Daniel;;;code generation;;;;;generate DT;;;;;;;;
3;Model-Driven Digital Twin Construction: Synthesizing the Integration of Cyber-Physical Systems with Their Information Systems;;GUI DSL;structure;;;;;;;;;;;;;;;Daniel;;;;;;;;;;;;;;;;
4;Measuring the Fidelity of Digital Twin Systems;;;;;;;;;;;;;;;;;;Daniel;Challenge/Position Paper;;;;;;;;;;;;;;;
5;Digital Twin as Risk-Free Experimentation Aid for Techno-Socio-Economic Systems;;;;;;;;;;;;;;;;;;Daniel;No MDE technique used;only the data generated by the simulation (which uses a model) is further used by the RL algorithm;model interpretation;;;;cf. Figure 6;;;;;;;;;
6;Using Trace Alignments for Measuring the Similarity between a Physical and Its Digital Twin;;snapshot model;;;;;snapshot model;trace alignment algorithm;;;Operate;Individual Systems, such as automated cars (Atorf and Roßmann, 2018), gas turbines (Dawes et al., 2019), or manufacturing machines (Debroy et al., 2017).;As-Operated;;;;;Daniel;;;model interpretation;;;;;perform trace alignment on snapshots of DT and PT;;A Digital Twin (DT) is a digital representation of an actual system, service or product (the Physical Twin (PT)), synchronized at a specified frequency and fidelity;lego mindstorms car;;;;;
7;Towards a Digital Twin for Cyber-Physical Production Systems: A Multi-Paradigm Modeling Approach in the Postal Industry;;;;;;;;;;;;;;;;;;Daniel;No MDE technique used;different behavioral models are described for a particular use case, but no MDE technique is applied on these models;;;;;;;;;;;;;;
8;A Novel Methodology to Construct Digital Twin Models for Spacecraft Operations Using Fault and Behaviour Trees;;n.d,;;;;;DT model;UI-based monitoring tools;;H  Transportation and Storage;Operate;Individual Systems, such as automated cars (Atorf and Roßmann, 2018), gas turbines (Dawes et al., 2019), or manufacturing machines (Debroy et al., 2017).;As-Operated;;;;;Daniel;;;model interpretation;;;;;visualize DT model (data from the running system) for human decision making;;"A Digital Twin (DT) is a virtual representation of a physical
product, asset, process, system, or service that allows us to understand, predict, and optimise their performance for better business
outcomes";ground station of a spacecraft;;;;;
9;Understanding and Improving Model-Driven IoT Systems through Accompanying Digital Twins;;MontiThings;;;;;MontiThings model;IoT controller code in C++;;;Operate;Individual Systems, such as automated cars (Atorf and Roßmann, 2018), gas turbines (Dawes et al., 2019), or manufacturing machines (Debroy et al., 2017).;As-Operated;;;;;Daniel;;;code generation;;;;;generate code that runs on an IoT system;;Digital twins (DTs) are digital representations of cyber-physical systems. They monitor systems to offer services to analyze, control, and optimize the system. Alas, there is no commonly agreed on definition of DTs;smart lawn watering system;;;The DT collects data from the generated IoT code, reproduces the data traces, adapts the input models accordingly, and re-generates the new software based on the adapted models;;
10;CPSAML: A Language and Code Generation Framework for Digital Twin Based Monitoring of Mobile Cyber-Physical Systems;;CPSAML (paper contribution);;textual;;;CPSAML;SysML (partial model);;I  Accommodation and Food Service Activities;Design;Individual Systems, such as automated cars (Atorf and Roßmann, 2018), gas turbines (Dawes et al., 2019), or manufacturing machines (Debroy et al., 2017).;As-Designed;basis for code generation, allows different levels of abstractions for different users (system architect/system engineer, VS software developer that works on the generated code);;"4-5: das Ding läuft ""im Labor""";;Daniel;;;code generation;;;;used xtend script, but actually, it's model to model;transform System Architect vision (CPSAML) into starting point for System Engineer (partial SysML model);"aggregates data from CPS into a ""single system snapchot""";middleware between CPS and a monitoring cockpit;Roomba floor cleaning robot;;;github repository: https://github.com/me-big-tuwien-ac-at/cpsaml;;
11;CPSAML: A Language and Code Generation Framework for Digital Twin Based Monitoring of Mobile Cyber-Physical Systems;;SysML v2;;textual;;;SysML (complete model);CPS software code (ROS Packages, DT, Monitoring Cockpit);;;Implement;;As-Designed;;;;;Daniel;;;code generation;;;;;generate software infrastructure from sysml models (structural and behavioral);;;;;;;;
12;On the Engineering of IoT-Intensive Digital Twin Software Systems;;n.d.;structure;;;;structural model of the PT;Model Synchronizer + Model Manager component;;;;;;;;;;Daniel;;No Implementation, only high-level proposal;model interpretation;;;;;;;;;;;very high-level concept, no application to a particular example/domain, no example models given;;
13;On the Engineering of IoT-Intensive Digital Twin Software Systems;;n.d.;behavior;;;;behavioral model of the PT;Model Synchronizer + Model Manager component;;;Design;;As-Designed;;;;;Daniel;;No Implementation, only high-level proposal;model interpretation;;;;;;;;;;;very high-level concept, no application to a particular example/domain, no example models given;;
14;A Flexible and Modular Architecture for Edge Digital Twin: Implementation and Evaluation;;;;;;;;;;;;;;;;;;Daniel;No Model used;;;;;;;;;;;;;;;
15;Semantic digital twins for organizational development;;;;;;;;;;;;;;;;;;Daniel;No implementation (e.g. Challenge/Position Paper);;;;;;;;;;;;;;;
16;"A pattern catalog for augmenting Digital Twin models with behavior; [Ein Musterkatalog zur Erweiterung von digitalen Zwillingsmodellen um Verhaltenssichten]";;;;;;;;;;;;;;;;;;Daniel;;;;;;;;;;;;;;;;
17;Ensuring consistency in scalable-detail models for DT-based control;;;;;;;;;;;;;;;;;;Daniel;No MDE technique used;focus is on consistency between different models (structural and behavioral);;;;;;;;;;;;;;
18;The OMiLAB Digital Innovation environment: Agile conceptual models to bridge business value with Digital and Physical Twins for Product-Service Systems development;;;;;;;;;;;;;;;;;;Daniel;;;;;;;;;;;;;;;;
19;Digital twin enhanced human-machine interaction in product lifecycle;;;;;;;;;;;;;;;;;;Daniel;No MDE technique used;;;;;;;;;;;;;;;
20;Modular Fault Ascription and Corrective Maintenance Using a Digital Twin;;;;;;;;;;;;;;;;;;Daniel;No MDE technique used;;;;;;;;;;;;;;;
21;Generating customized low-code development platforms for digital twins;;MontiArc;;textual;;;MontiArc-Model describing Software + Monti-Arc Model describing DSLs;Digital Twin Implementation;;C  Manufacturing;Implement;Individual Systems, such as automated cars (Atorf and Roßmann, 2018), gas turbines (Dawes et al., 2019), or manufacturing machines (Debroy et al., 2017).;As-Designed;easily integrate different implementations (monti arc as definition of common interfaces);account for future variability;"4-5: das Ding läuft ""im Labor""";;Daniel;;;code generation;;Model-Driven Architecture?;;;Generate DT architecture implementation from DT plugins (combine software + language components);realize self-adaptation loop for CPS;"a digital twin is ""a set of models of the system, a set of digital shadows and their aggregation and abstraction collected from a system, and a set of services that allow using the data and models purposefully with respect to the original system""";injection molding machine;;;;;
22;Generating customized low-code development platforms for digital twins;;;;low-code interface;;;Service configuration models (written in DSLs specified together with the service definition in montiarc);Digital Twin Implementation;;;Operate;;As-Operated;configurability: easily configure 1 implementation for different CPSs;"LCDP should also support ""collaborative development""";;;Daniel;;;model interpretation;;;;;configure existing DT architecture;;;;;;;;
23;A data-model fusion dispatch strategy for the building energy flexibility based on the digital twin;;;;;;;;;;;;;;;;;;Daniel;No MDE technique used;;;;;;;;;;;;;;;
24;Meta-model-based shop-floor digital twin architecture, modeling and application;;SysML (meta-model, I assume they mean BDD/structural representation);;;;;raw data;SysML;;C  Manufacturing;Design;Systems of Systems, such as complete factories (Biesinger et al., 2018), oil wells (Kosenkov et al., 2018), or railway systems (Vatn, 2018).;As-Designed;;;"4-5: das Ding läuft ""im Labor""";;Daniel;;;model interpretation;;traceability;;;align data from CPS with SysML model;Provide Self-Adapation/Optimization based on (i) data from PT, (ii) operations offered by the PT;"the Shop-floor Digital Twin (SDT), as the digital counterpart of physical entities including the humans, machines, material, methods and environments in the existing shop-floor, mirrors the physical shop-floor behavior and performance in the virtual space. The digital counterpart is comprised of a series of semantic digital models and simulation models of the physical shop-floor and has the automatic data synchronization between the physical and virtual space. By establishing the automatic data flow between the physical shop-floor and digital counterpart, the semantic digital models and simulation 
models could be converted to digital shadow and further evolved into SDT.";shopfloor;;;Das Papier gehört imho gepunished dafür, dass sie behaupten, dass sie ihre Meta-Modelle in SysML erstellt haben;;
25;Meta-model-based shop-floor digital twin architecture, modeling and application;;;;;;;;;;;Operate;;;;;;;Daniel;;;;;;;;;;;;;;;;
26;3D crowdsourced parametric cadastral mapping: Pathways integrating BIM/IFC, crowdsourced data and LADM;;;;;;;;;;;;;;;;;;Daniel;No MDE technique used;;;;;;;;;;;;;;;
27;Generating Digital Twin Cockpits for Parameter Management in the Engineering of Wind Turbines;;UML Class Diagram;;textual;;;UML Class Diagram;UI Model;;D  Electricity, Gas, Steam and Air Conditioning Supply;Implement;Individual Systems, such as automated cars (Atorf and Roßmann, 2018), gas turbines (Dawes et al., 2019), or manufacturing machines (Debroy et al., 2017).;As-Designed;reduce complexity in system design by bridging the gap between high-level requirements and high-detail implementations;;1-3: die Technologie gibt's, evtl. am Toy Example gezeigt;;Daniel;;;Model to Model Transformation;cf. Figure 3;;;;;???virtual representation of data from the physical system?? Very generic, no explicit purpose stated;a digital twin of a system consists of a set of models of the system, a set of digital shadows, and provides a set of services to use the data and models purposefully with respect to the original system [Da20].;cooling system of a wind turbine;;;;;
28;Generating Digital Twin Cockpits for Parameter Management in the Engineering of Wind Turbines;;UI Model;;;;;UML Class Diagram;Part of DT UI Cockpit;;;;;;;;;;Daniel;;;code generation;cf. Figure 3;;;;;;;;;;;;
29;Generating Digital Twin Cockpits for Parameter Management in the Engineering of Wind Turbines;;;;;;;UI Model;Part of DT UI Cockpit;;;;;;;;;;Daniel;;;;;;;;;;;;;;;;
30;Digital Twin Enables Rational Design of Ultrahigh-Power Lithium-Ion Batteries;;;;;;;;;;;;;;;;;;Daniel;No MDE technique used;;;;;;;;;;;;;;;
31;A framework for Model-Driven Engineering of resilient software-controlled systems;;SysML BDD;;;;;SysML BDD;Knowledge Base of software digital twins (Metamodel proposed in Figure 5 of the paper);;;;;;;;;;Daniel;;;Model to Model Transformation;;;;;reuse information created by reliability engineers (sysml) for concrete software implementation;;;;;;;;
32;A framework for Model-Driven Engineering of resilient software-controlled systems;;Knowledge base model (contribution of the paper;;;;;reliability requirements;executable models of failure modes (as fault trees);;H  Transportation and Storage;Plan;;As-Designed;formal specification of information in the form of models allows the application of MDE techniques (model transformations);;1-3: die Technologie gibt's, evtl. am Toy Example gezeigt;;Daniel;;;;;;;;reuse information created by reliability engineers (sysml) for concrete software implementation;not specified;not specified;limited traffic zone access control;mde bridges gap between plan (reliability requirements engineering) and design of the system (definition of software architecture before actual implementation);;;;
33;A framework for Model-Driven Engineering of resilient software-controlled systems;;fault trees;;;;;;;;;Design;;;;;;;Daniel;;;;;;;;;;;;;;;;
34;Model-Driven Development of a Digital Twin for Injection Molding;;;;;;;;;;;;;;;;;;Daniel;;;;;;;;;realizes self-adaptation loop based on MAPE (cf. Figure 2);A digital twin of a system consists of a set of models of the system, a set of digital shadows, and provides a set of services to use the data and models purposefully with respect to the original system.;;;;;;
35;The Framework for Designing Autonomous Cyber-Physical Multi-agent Systems for Adaptive Resource Management;;montiarc, class diagrams, event language, DoE;;notation;;;DT MontiArc architecture, domain, data processor;"Java code for the DTs
logic for data retrieval, communication with the CPPS, evaluation of DSs, and
reaction to these";;C  Manufacturing;Implement;Individual Systems, such as automated cars (Atorf and Roßmann, 2018), gas turbines (Dawes et al., 2019), or manufacturing machines (Debroy et al., 2017).;As-Designed;textual notation that helps domain experts cope with software;All DSLs that we introduced are tailored to support the specification of DTs, but in other domains, different notations might be standard, and therefore, modeling relevant data elements and behaviors might be challenging. So far, no human interaction with the DT is considered. Since domain experts usually have domain knowledge that can help the DT to react appropriately to events, integrating such knowledge at runtime will be future work;"4-5: das Ding läuft ""im Labor""";;Daniel;;;code generation;;;;;generate software implementation from textual description/configure predefined architecture using textual description;;;injection molding machine;;;;;
36;The Research of Aero-engine Digital Twin Model Based on Model-driven and Data-driven Fusion Method;;;;;;;;;;;;;;;;;;Daniel;No MDE technique used;;;;;;;;;;;;;;;
37;Generative and Model-driven SDK development for the Industrie 4.0 Digital Twin;;AAS, AAS Domain-specific language;;;;;AAS Domain-Specific Model;C#/Java Stubs + Contracts;;;Implement;;As-Designed;;;1-3: die Technologie gibt's, evtl. am Toy Example gezeigt;;Daniel;;;code generation;;;;;Generate SDK from AAS specification. SDK can be used to implement DT;reasoning in the virtual space;A digital twin allows us to reason about a physical and/or ideal assets in the virtual (i.e. cyber) space thus providing a necessary foundation for complex and large cyber-physical systems.;;;;no demonstration or evaluation provided, only description of the prototypical implementation of the proposed concept;;
38;Towards a Reference Architecture for Leveraging Model Repositories for Digital Twins;;UML CD/AD;;textual;;;UML model;services that interact with the PT based on the UML models;;;Operate;Individual Systems, such as automated cars (Atorf and Roßmann, 2018), gas turbines (Dawes et al., 2019), or manufacturing machines (Debroy et al., 2017).;As-Operated;common knowledge base;;1-3: die Technologie gibt's, evtl. am Toy Example gezeigt;;Daniel;;;model interpretation;;;;;model as common knowledge base;;a Digital Twin (DT) can be build to act as virtual representation for control, regulation, and adaption, ideally across the entire life-cycle of CPS;;;;;;
39;Digital Twin Operational Platform for Connectivity and Accessibility using Flask Python;;;;;;;;;;;;;;;;;;Daniel;No MDE technique used;;;;;;;;;;;;;;;
40;Data- and model-driven digital twins for design and logistics control of product distribution;;;;;;;;;;;;;;;;;;Daniel;No MDE technique used;;;Tool: RobotStudio (ABB proprietary);;;;;;;;;;;;
41;A software engineering point of view on digital twin architecture;;;;;;;;;;;;;;;;;;Daniel;No MDE technique used;;;;;;;;;;;;;;;
42;Process Prediction with Digital Twins;;Domain Language, OCL, Tagging Language, Data language, GUI language, Process Language, MontiArc, DS + Process Structure Language;;;;;All beforementioned models;DT implementation;;C  Manufacturing;Implement;Individual Systems, such as automated cars (Atorf and Roßmann, 2018), gas turbines (Dawes et al., 2019), or manufacturing machines (Debroy et al., 2017).;As-Operated;high-level access to software configuraiton for domain experts;;1-3: die Technologie gibt's, evtl. am Toy Example gezeigt;;Daniel;;;code generation;;Model-Driven Architecture: ASM: Domain, OCL, Tagging, Data, GUI, Process Model. AIM: MontiArc, Basic DS structure, Basic Process Structure Model;;;automatically derive DT implementation from DSLs;realize self-adaptation based on MAPE pattern;software systems that can actively represent, control, and/or optimize the behavior of an observed (cyber-physical) system. Such a DT of a system consists of a set of models of the system, a set of Digital Shadows (DSs), and provides a set of services to use the data and models purposefully with respect to the original system;;injection molding machine;;;;
43;AML4DT: A Model-Driven Framework for Developing and Maintaining Digital Twins with AutomationML;;AML;;textual;;;AML;platform-neutral DT metamodel;;;;;;represent information across asset lifecycle, reuse information based on machine-readable format of models;;;;Daniel;;;Model to Model Transformation;;;;;reuse information from existing engineering model (AML) for setting up/evolving DTs;;;;;;;;
44;AML4DT: A Model-Driven Framework for Developing and Maintaining Digital Twins with AutomationML;;platform-neutral DT metamodel (contribution of the paper);;textual;;;platform-neutral DT metamodel;DTDL;;;;;;;;;;Daniel;;;Model to Model Transformation;;;;;generate proprietary DTDL model from platform-neutral DT model;;;;;;;;
45;AML4DT: A Model-Driven Framework for Developing and Maintaining Digital Twins with AutomationML;;DTDL;;textual;;;DTDL;Microsoft Azure DT Service;;N  Administrative and Support Service Activities;Implement;Individual Systems, such as automated cars (Atorf and Roßmann, 2018), gas turbines (Dawes et al., 2019), or manufacturing machines (Debroy et al., 2017).;As-Designed;reduces complexity through abstraction, enables automation through model-driven engineering;"Further Model-Driven Software Engineering (MDSE) research for DTs. From the MDSE perspective, the realization of such an approach requires (1) the adaption of existing generators such as MontiGem to be able to handle the additional models in different Domain-Specific Languages (DSLs), (2) the integration of further generation steps, (3) to extend the runtime environment of the DT to be able to handle process models at runtime, and (4) to extend the runtime environment of the DT or provide APIs to include process mining services.

Derive DTs from engineering models

Automatically exploiting DT insights. Where digital twins
are in place, they can provide tremendous insights about the
operation of the particular observed system instance. Often,
these insights can be applied to other instances of the same
system type, similar systems, and future versions of these systems. Yet, we are lacking means to automatically exploit these
insights sustainably. Automatically improving the engineering
models of the observed system based on insights produced
by its digital twins could be valuable angle to improve this.

Models at runtime in DTs. From
a computer science perspective, the long-term operation of
digital twins poses further challenges such as how to handle
DS and DS-type evolvement,";1-3: die Technologie gibt's, evtl. am Toy Example gezeigt;;Daniel;;;model interpretation;;;;this part is not an actual contribution of the paper, but already provided by the Azure DT platform;setup twins in DT service based on DTDL model;interface to running system;dynamic virtual model of a system, processor, or service, with data (e.g., sensor data) from physical systems or processes integrated into it.;Air Quality Opitmization System;;;;;
46;Twin Process Model Driven Machining Quality Optimization for Complex Parts;;not specified;;;;;model containing structural and behavioral (process) information;;;C  Manufacturing;Operate;Individual Systems, such as automated cars (Atorf and Roßmann, 2018), gas turbines (Dawes et al., 2019), or manufacturing machines (Debroy et al., 2017).;As-Designed;represent structural/behavioral information in a machine-readable format;;1-3: die Technologie gibt's, evtl. am Toy Example gezeigt;;Daniel;;;model interpretation;;;;;;efficiently realizes simulation, monitoring and control of multi scale and physical quantity;an intelligent method to link machining process and process design, which is benefit to the scientific control of machining quality.;;integral impeller cutting;;;;
47;Multisource Model-Driven Digital Twin System of Robotic Assembly;;;;;;;;;;;;;;;;;;Daniel;No MDE technique used;;;;;;;;;;;;;;;
48;Semantic Interoperability of Digital Twins: Ontology-based Capability Checking in AAS Modeling Framework;;OWL Ontology + OML Vocabulary;;;;;OML Vocabulary;UML Profile;;C  Manufacturing;Design;Systems of Systems, such as complete factories (Biesinger et al., 2018), oil wells (Kosenkov et al., 2018), or railway systems (Vatn, 2018).;As-Designed;formal definition that allows reasoning on/interpretation of models, interoperability;;1-3: die Technologie gibt's, evtl. am Toy Example gezeigt;;Daniel;;;Model to Model Transformation;;;EMF;additionally, OML is defined according to the OWL Ontology (conformsTo), and AAS models are annotated using the UML Profile;convert OML Vocabulary into UML Profile that can be applied to AAS models;AAS model, enriched with semantic annotations based on OWL ontology;;robotic cell (niryo ned for gripping + turtlebot for transportation);;;;;
49;Semantic Interoperability of Digital Twins: Ontology-based Capability Checking in AAS Modeling Framework;;UML Profile;;;;;AAS Model (annotated with UML stereotypes);OWL individuals;;;;;;;;;;Daniel;;;Model to Model Transformation;;;EMF;;;;;;;;;;
50;Semantic Interoperability of Digital Twins: Ontology-based Capability Checking in AAS Modeling Framework;;AAS;;;;;OWL Ontology + OWL Individuals;capability matchmaker;;;;;;;;;;Daniel;;;model interpretation;;;EMF;;apply SPARQL Queries on Ontology Models, and assess the results within the capability matchmaker (cf. Section 4.B);;;;;;;;
51;Semantic Interoperability of Digital Twins: Ontology-based Capability Checking in AAS Modeling Framework;;OWL Individuals (instantiated OWL ontology);;;;;AAS Model;user interface created by the authors (cf. Section 4.C);;;;;;;;;;Daniel;;;model interpretation;;;EMF;;integrate AAS models into the overall proces (also involving the two model transformations described above), which is handled by the developed user interface;;;;;;;;
52;A Lightweight Model-driven MES Simulation Framework Based On Probabilistic Finite Automata;;;;;;;;;;;;;;;;;;Daniel;No MDE technique used;theroetisch reden sie davon, dass die simulationen konfiguriert werden, bzw. die simulationsdaten interpretiert werden könnenaber von einer konkreten Implementierung beschreiben sie nichts;;;;;;;;;;;;;;
53;Digital Twin of an Electrical Motor Based on Empirical Performance Model;;Unity 3D simulation model describing detailed physics of twinned asset;;;;;Unity Model;Simulation Controller;;H  Transportation and Storage;Operate;Individual Systems, such as automated cars (Atorf and Roßmann, 2018), gas turbines (Dawes et al., 2019), or manufacturing machines (Debroy et al., 2017).;As-Designed;simulation;;1-3: die Technologie gibt's, evtl. am Toy Example gezeigt;;Daniel;;;;;;;;use feedback from simulation in simulation controller;3D simulation model that is updated with live data from the twinned asset;The concept of Digital Twin (DT) is creating and maintaining a digital representation of the real physical entity and supporting its performance through simulation and optimization tools, which are fed with real and updated data.;;Electrical Motor (phase = operate, because simulation is fed with live data by the simulation controller);;;;
54;Closed-Loop Systems Engineering (CLOSE): Integrating Experimentable Digital Twins with the Model-Driven Engineering Process;;;;;;;;;;;;;;;;;;Daniel;No MDE technique used;paper proposes a process how humans develop systems based on experimental DTs;;;;;;;;;;;;;;
