J;"Gutierrez-Franco, E; Mejia-Argueta, C; Rabelo, L";;;;"Gutierrez-Franco, Edgar; Mejia-Argueta, Christopher; Rabelo, Luis";;;Data-Driven Methodology to Support Long-Lasting Logistics and Decision Making for Urban Last-Mile Operations;SUSTAINABILITY;;;;;;;;;;;;;;;;;;"Mejia Argueta, Christopher/0000-0002-4601-2459; Gutierrez-Franco, Edgar/0000-0002-8128-5356";;;;;;;;;;;;;;2071-1050;;;;JUN;2021;13;11;;;;;;;6230;10.3390/su13116230;http://dx.doi.org/10.3390/su13116230;;;;;;;;;;;;;WOS:000660763000001;View Full Record in Web of Science
C;"Gorodetsky, VI; Kozhevnikov, SS; Novichkov, D; Skobelev, PO";;"Marik, V; Kadera, P; Rzevski, G; Zoitl, A; AnderstKotsis, G; Tjoa, AM; Khalil, I";;"Gorodetsky, V., I; Kozhevnikov, S. S.; Novichkov, D.; Skobelev, P. O.";;;The Framework for Designing Autonomous Cyber-Physical Multi-agent Systems for Adaptive Resource Management;INDUSTRIAL APPLICATIONS OF HOLONIC AND MULTI-AGENT SYSTEMS (HOLOMAS 2019);Lecture Notes in Artificial Intelligence;;;;9th International Conference on Industrial Applications of Holonic and Multi-Agent Systems (HoloMAS);AUG 26-29, 2019;Linz, AUSTRIA;Software Competence Ctr Hagenberg,JKU,@WAS;;;;;;;;;;Novichkov, Dmitriy/0000-0002-4635-8177;;;;;;;;;;;;;0302-9743;1611-3349;"978-3-030-27878-6; 978-3-030-27877-9";;;;2019;11710;;;;;;52;64;;10.1007/978-3-030-27878-6_5;http://dx.doi.org/10.1007/978-3-030-27878-6_5;;;;;;;;;;;;;WOS:000611680100005;View Full Record in Web of Science
C;"Negrin, DAM; Cleophas, L; van den Brand, M";;;IEEE COMP SOC;"Negrin, David A. Manrique; Cleophas, Loek; van den Brand, Mark";;;Using Ptolemy II as a Framework for Virtual Entity Integration and Orchestration in Digital Twins;24TH ACM/IEEE INTERNATIONAL CONFERENCE ON MODEL-DRIVEN ENGINEERING LANGUAGES AND SYSTEMS COMPANION (MODELS-C 2021);;;;;24th International ACM/IEEE Conference on Model-Driven Engineering Languages and Systems (MODELS);OCT 10-15, 2021;ELECTR NETWORK;IEEE,Assoc Comp Machinery,ACM SIGSOFT,IEEE Comp Soc,IEEE Tech Council Software Engn;;;;;;;;;;;;;;;;;;;;;;;;;978-1-6654-2484-4;;;;2021;;;;;;;235;238;;10.1109/MODELS-C53483.2021.00041;http://dx.doi.org/10.1109/MODELS-C53483.2021.00041;;;;;;;;;;;;;WOS:000749362300035;View Full Record in Web of Science
C;"Palomes, XPI; Tuset-Peiro, P; Casas, PFI";;;IEEE COMP SOC;"Pi i Palomes, Xavier; Tuset-Peiro, Pere; Fonseca i Casas, Pau";;;Combining Low-Code Programming and SDL-Based Modeling with Snap! in the Industry 4.0 Context;24TH ACM/IEEE INTERNATIONAL CONFERENCE ON MODEL-DRIVEN ENGINEERING LANGUAGES AND SYSTEMS COMPANION (MODELS-C 2021);;;;;24th International ACM/IEEE Conference on Model-Driven Engineering Languages and Systems (MODELS);OCT 10-15, 2021;ELECTR NETWORK;IEEE,Assoc Comp Machinery,ACM SIGSOFT,IEEE Comp Soc,IEEE Tech Council Software Engn;;;;;;;;;;;;;;;;;;;;;;;;;978-1-6654-2484-4;;;;2021;;;;;;;742;751;;10.1109/MODELS-C53483.2021.00120;http://dx.doi.org/10.1109/MODELS-C53483.2021.00120;;;;;;;;;;;;;WOS:000749362300113;View Full Record in Web of Science
J;"Gkeli, M; Potsiou, C";;;;"Gkeli, Maria; Potsiou, Chryssy";;;3D crowdsourced parametric cadastral mapping: Pathways integrating BIM/IFC, crowdsourced data and LADM;LAND USE POLICY;;;;;;;;;;;;;;;;;;;;;;;;;;;;;;;0264-8377;1873-5754;;;;AUG;2023;131;;;;;;;;106713;10.1016/j.landusepol.2023.106713;http://dx.doi.org/10.1016/j.landusepol.2023.106713;;MAY 2023;;;;;;;;;;;WOS:000998924500001;View Full Record in Web of Science
C;"Lyan, G; Jezequel, JM; Gross-Amblard, D; Combemale, B";;;IEEE Comp Soc;"Lyan, Gauthier; Jezequel, Jean-Marc; Gross-Amblard, David; Combemale, Benoit";;;DataTime: a Framework to smoothly Integrate Past, Present and Future into Models;24TH INTERNATIONAL CONFERENCE ON MODEL-DRIVEN ENGINEERING LANGUAGES AND SYSTEMS (MODELS 2021);;;;;24th International ACM/IEEE Conference on Model-Driven Engineering Languages and Systems (MODELS);OCT 10-15, 2021;ELECTR NETWORK;IEEE,Assoc Comp Machinery,ACM SIGSOFT,IEEE Comp Soc,IEEE Tech Council Software Engn;;;;;;;;;Jezequel, Jean-Marc/AAF-3854-2019;"Jezequel, Jean-Marc/0000-0002-0582-9745; LYAN, Gauthier/0000-0003-4711-6636";;;;;;;;;;;;;;;978-1-6654-3495-9;;;;2021;;;;;;;134;144;;10.1109/MODELS50736.2021.00022;http://dx.doi.org/10.1109/MODELS50736.2021.00022;;;;;;;;;;;;;WOS:000747591300013;View Full Record in Web of Science
J;"Perisic, A; Perisic, I; Perisic, B";;;;"Perisic, Ana; Perisic, Ines; Perisic, Branko";;;Simulation-Based Engineering of Heterogeneous Collaborative Systems-A Novel Conceptual Framework;SUSTAINABILITY;;;;;;;;;;;;;;;;;Perisic, Ana/AAF-4925-2021;"Perisic, Ana/0000-0002-9093-9462; Perisic, Branko/0000-0003-2624-2895";;;;;;;;;;;;;;2071-1050;;;;MAY 30;2023;15;11;;;;;;;8804;10.3390/su15118804;http://dx.doi.org/10.3390/su15118804;;;;;;;;;;;;;WOS:001004669600001;View Full Record in Web of Science
C;"Chen, XM; Kang, E; Shiraishi, S; Preciado, VM; Jiang, ZH";;;ACM;"Chen, Ximing; Kang, Eunsuk; Shiraishi, Shinichi; Preciado, Victor M.; Jiang, Zhihao";;;Digital Behavioral Twins for Safe Connected Cars;21ST ACM/IEEE INTERNATIONAL CONFERENCE ON MODEL DRIVEN ENGINEERING LANGUAGES AND SYSTEMS (MODELS 2018);;;;;21st ACM/IEEE International Conference on Model Driven Engineering Languages and Systems (MODELS);OCT 14-19, 2018;Copenhagen, DENMARK;IEEE,ACM,JetBrains,MPS,Eclipse Fdn,Papyrus Ind Consortium,HCL,ACM Special Interest Grp Software Engn,IEEE Comp Soc,IT Univ Copenhagen;;;;;;;;;;Jiang, Zhihao/0000-0002-6730-6915;;;;;;;;;;;;;;;978-1-4503-4949-9;;;;2018;;;;;;;144;153;;10.1145/3239372.3239401;http://dx.doi.org/10.1145/3239372.3239401;;;;;;;;;;;;;WOS:000508877300014;View Full Record in Web of Science
