Publication Type;Authors;Book Authors;Book Editors;Book Group Authors;Author Full Names;Book Author Full Names;Group Authors;Article Title;Source Title;Book Series Title;Book Series Subtitle;Language;Document Type;Conference Title;Conference Date;Conference Location;Conference Sponsor;Conference Host;Author Keywords;Keywords Plus;Abstract;Addresses;Affiliations;Reprint Addresses;Email Addresses;Researcher Ids;ORCIDs;Funding Orgs;Funding Name Preferred;Funding Text;Cited References;Cited Reference Count;Times Cited, WoS Core;Times Cited, All Databases;180 Day Usage Count;Since 2013 Usage Count;Publisher;Publisher City;Publisher Address;ISSN;eISSN;ISBN;Journal Abbreviation;Journal ISO Abbreviation;Publication Date;Publication Year;Volume;Issue;Part Number;Supplement;Special Issue;Meeting Abstract;Start Page;End Page;Article Number;DOI;DOI Link;Book DOI;Early Access Date;Number of Pages;WoS Categories;Web of Science Index;Research Areas;IDS Number;Pubmed Id;Open Access Designations;Highly Cited Status;Hot Paper Status;Date of Export;UT (Unique WOS ID);Web of Science Record
C;"Govindasamy, HS; Jayaraman, R; Taspinar, B; Lehner, D; Wimmer, M";;;IEEE COMP SOC;"Govindasamy, Hari Shankar; Jayaraman, Ramya; Taspinar, Burcu; Lehner, Daniel; Wimmer, Manuel";;;Air Quality Management: An Exemplar for Model-Driven Digital Twin Engineering;24TH ACM/IEEE INTERNATIONAL CONFERENCE ON MODEL-DRIVEN ENGINEERING LANGUAGES AND SYSTEMS COMPANION (MODELS-C 2021);;;;;24th International ACM/IEEE Conference on Model-Driven Engineering Languages and Systems (MODELS);OCT 10-15, 2021;ELECTR NETWORK;IEEE,Assoc Comp Machinery,ACM SIGSOFT,IEEE Comp Soc,IEEE Tech Council Software Engn;;;;;;;;;;;;;;;;;;;;;;;;;978-1-6654-2484-4;;;;2021;;;;;;;231;234;;10.1109/MODELS-C53483.2021.00040;http://dx.doi.org/10.1109/MODELS-C53483.2021.00040;;;;;;;;;;;;;WOS:000749362300034;View Full Record in Web of Science
C;"Dalibor, M; Michael, J; Rumpe, B; Varga, S; Wortmann, A";;"Dobbie, G; Frank, U; Kappel, G; Liddle, SW; Mayr, HC";;"Dalibor, Manuela; Michael, Judith; Rumpe, Bernhard; Varga, Simon; Wortmann, Andreas";;;Towards a Model-Driven Architecture for Interactive Digital Twin Cockpits;CONCEPTUAL MODELING, ER 2020;Lecture Notes in Computer Science;;;;39th International Conference on Conceptual Modeling (ER);NOV 03-06, 2020;Vienna, AUSTRIA;;;;;;;;;;"Michael, Judith/S-2844-2016; Rumpe, Bernhard/S-8216-2016";"Michael, Judith/0000-0002-4999-2544; Dalibor, Manuela/0000-0002-1948-0556; Varga, Simon/0000-0002-8351-4394; Rumpe, Bernhard/0000-0002-2147-1966";;;;;;;;;;;;;0302-9743;1611-3349;"978-3-030-62522-1; 978-3-030-62521-4";;;;2020;12400;;;;;;377;387;;10.1007/978-3-030-62522-1_28;http://dx.doi.org/10.1007/978-3-030-62522-1_28;;;;;;;;;;;;;WOS:000587241100028;View Full Record in Web of Science
S;"Michael, J; Wortmann, A";;"Dolgui, A; Bernard, A; Lemoine, D; VonCieminski, G; Romero, D";;"Michael, Judith; Wortmann, Andreas";;;Towards Development Platforms for Digital Twins: A Model-Driven Low-Code Approach;ADVANCES IN PRODUCTION MANAGEMENT SYSTEMS: ARTIFICIAL INTELLIGENCE FOR SUSTAINABLE AND RESILIENT PRODUCTION SYSTEMS, APMS 2021, PT I;IFIP Advances in Information and Communication Technology;;;;International-Federation-of-Information-Processing-Working-Group-5.7 (IFIP WG 5.7) International Conference on Advances in Production Management Systems (APMS);SEP 05-09, 2021;ELECTR NETWORK;Int Fed Informat Proc Working Grp 5 7 Advances Prod Management Syst,IMT Atlantique,Univ Nantes, Centrale Nantes,Rennes Business Sch,Audecia Business Sch;;;;;;;;;"Michael, Judith/AAE-2646-2022; Michael, Judith/S-2844-2016; Rumpe, Bernhard/S-8216-2016";"Michael, Judith/0000-0002-4999-2544; Michael, Judith/0000-0002-4999-2544; Rumpe, Bernhard/0000-0002-2147-1966";;;;;;;;;;;;;1868-4238;1868-422X;"978-3-030-85874-2; 978-3-030-85873-5";;;;2021;630;;;;;;333;341;;10.1007/978-3-030-85874-2_35;http://dx.doi.org/10.1007/978-3-030-85874-2_35;;;;;;;;;;;;;WOS:000717630100035;View Full Record in Web of Science
C;"Bordeleau, F; Cleophas, L; Combemale, B; Eramo, R; van den Brand, M; Wimmer, M; Wortmann, A";;;IEEE COMP SOC;"Bordeleau, Francis; Cleophas, Loek; Combemale, Benoit; Eramo, Romina; van den Brand, Mark; Wimmer, Manuel; Wortmann, Andreas";;;MoDDiT 2021: 1st International Workshop on Model-Driven Engineering for Digital Twins;24TH ACM/IEEE INTERNATIONAL CONFERENCE ON MODEL-DRIVEN ENGINEERING LANGUAGES AND SYSTEMS COMPANION (MODELS-C 2021);;;;;24th International ACM/IEEE Conference on Model-Driven Engineering Languages and Systems (MODELS);OCT 10-15, 2021;ELECTR NETWORK;IEEE,Assoc Comp Machinery,ACM SIGSOFT,IEEE Comp Soc,IEEE Tech Council Software Engn;;;;;;;;;;van den Brand, Mark/0000-0003-3529-6182;;;;;;;;;;;;;;;978-1-6654-2484-4;;;;2021;;;;;;;212;213;;10.1109/MODELS-C53483.2021.00036;http://dx.doi.org/10.1109/MODELS-C53483.2021.00036;;;;;;;;;;;;;WOS:000749362300030;View Full Record in Web of Science
C;"Cheng, Y; Huang, XL; Xu, YH";;;DESTECH PUBLICAT INC;"Cheng, Yan; Huang, Xue-liang; Xu, Yuan-heng";;;Implementation of Model-driven Complex System Engineering Development System;2018 INTERNATIONAL CONFERENCE ON ELECTRICAL, CONTROL, AUTOMATION AND ROBOTICS (ECAR 2018);DEStech Transactions on Engineering and Technology Research;;;;International Conference on Electrical, Control, Automation and Robotics (ECAR);SEP 16-17, 2018;Xiamen, PEOPLES R CHINA;;;;;;;;;;;;;;;;;;;;;;;;2475-885X;;978-1-6059-5579-7;;;;2018;307;;;;;;77;83;;;;;;;;;;;;;;;;WOS:000453087200014;View Full Record in Web of Science
C;"Brockhoff, T; Heithoff, M; Koren, I; Michael, J; Pfeiffer, J; Rumpe, B; Uysal, MS; Van der Aalst, WMP; Wortmann, A";;;IEEE COMP SOC;"Brockhoff, Tobias; Heithoff, Malte; Koren, Istvan; Michael, Judith; Pfeiffer, Jerome; Rumpe, Bernhard; Uysal, Merih Seran; Van der Aalst, Wil M. P.; Wortmann, Andreas";;;Process Prediction with Digital Twins;24TH ACM/IEEE INTERNATIONAL CONFERENCE ON MODEL-DRIVEN ENGINEERING LANGUAGES AND SYSTEMS COMPANION (MODELS-C 2021);;;;;24th International ACM/IEEE Conference on Model-Driven Engineering Languages and Systems (MODELS);OCT 10-15, 2021;ELECTR NETWORK;IEEE,Assoc Comp Machinery,ACM SIGSOFT,IEEE Comp Soc,IEEE Tech Council Software Engn;;;;;;;;;"Michael, Judith/S-2844-2016; van der Aalst, Wil/G-1248-2011; Michael, Judith/AAE-2646-2022";"Michael, Judith/0000-0002-4999-2544; van der Aalst, Wil/0000-0002-0955-6940; Michael, Judith/0000-0002-4999-2544";;;;;;;;;;;;;;;978-1-6654-2484-4;;;;2021;;;;;;;184;189;;10.1109/MODELS-C53483.2021.00032;http://dx.doi.org/10.1109/MODELS-C53483.2021.00032;;;;;;;;;;;;;WOS:000749362300026;View Full Record in Web of Science
C;"Di Maio, M; Kapos, GD; Klusmann, N; Atorf, L; Dahmen, U; Schluse, M; Rossmann, J";;;IEEE;"Di Maio, Marco; Kapos, George-Dimitrios; Klusmann, Niklas; Atorf, Linus; Dahmen, Ulrich; Schluse, Michael; Rossmann, Juergen";;;Closed-Loop Systems Engineering (CLOSE): Integrating Experimentable Digital Twins with the Model-Driven Engineering Process;2018 4TH IEEE INTERNATIONAL SYMPOSIUM ON SYSTEMS ENGINEERING (ISSE);;;;;4th IEEE International Symposium on Systems Engineering (ISSE);OCT 01-03, 2018;Rome, ITALY;IEEE,IEEE Syst Council;;;;;;;;;;;;;;;;;;;;;;;;;978-1-5386-4446-1;;;;2018;;;;;;;;;;;;;;;;;;;;;;;;WOS:000469921000011;View Full Record in Web of Science
J;"Li, X; He, B; Zhou, YM; Li, G";;;;"Li, Xin; He, Bin; Zhou, Yanmin; Li, Gang";;;Multisource Model-Driven Digital Twin System of Robotic Assembly;IEEE SYSTEMS JOURNAL;;;;;;;;;;;;;;;;;bin, he/AAV-6319-2021;"Li, Gang/0000-0003-3141-4428; li, xin/0000-0001-6003-7719";;;;;;;;;;;;;1932-8184;1937-9234;;;;MAR;2021;15;1;;;;;114;123;;10.1109/JSYST.2019.2958874;http://dx.doi.org/10.1109/JSYST.2019.2958874;;;;;;;;;;;;;WOS:000628985900013;View Full Record in Web of Science
C;"Shokooh, S; Nordvik, G";;;IEEE;"Shokooh, Shervin; Nordvik, Geir";;;A MODEL-DRIVEN APPROACH FOR SITUATIONAL INTELLIGENCE & OPERATIONAL AWARENESS;2019 PETROLEUM AND CHEMICAL INDUSTRY CONFERENCE EUROPE (PCIC EUROPE);Petroleum and Chemical Industry Conference Europe;;;;16th PCIC Europe Annual Electrical and Automation Knowledge Sharing Event;MAY 07-09, 2019;Paris, FRANCE;;;;;;;;;;;;;;;;;;;;;;;;2166-949X;;978-3-9524799-5-7;;;;2019;;;;;;;118;125;;10.23919/pciceurope46863.2019.9011632;http://dx.doi.org/10.23919/pciceurope46863.2019.9011632;;;;;;;;;;;;;WOS:000552759400011;View Full Record in Web of Science
C;"Lehner, D; Sint, S; Vierhauser, M; Narzt, W; Wimmer, M";;;IEEE;"Lehner, Daniel; Sint, Sabine; Vierhauser, Michael; Narzt, Wolfgang; Wimmer, Manuel";;;AML4DT: A Model-Driven Framework for Developing and Maintaining Digital Twins with AutomationML;2021 26TH IEEE INTERNATIONAL CONFERENCE ON EMERGING TECHNOLOGIES AND FACTORY AUTOMATION (ETFA);IEEE International Conference on Emerging Technologies and Factory Automation-ETFA;;;;26th IEEE International Conference on Emerging Technologies and Factory Automation (ETFA);SEP 07-10, 2021;ELECTR NETWORK;Inst Elect & Elect Engineers,Malardalen Univ,IEEE Ind Elect Soc;;;;;;;;;Vierhauser, Michael/GNH-4778-2022;Sint, Sabine/0000-0001-8076-8228;;;;;;;;;;;;;1946-0740;1946-0759;978-1-7281-2989-1;;;;2021;;;;;;;;;;10.1109/ETFA45728.2021.9613376;http://dx.doi.org/10.1109/ETFA45728.2021.9613376;;;;;;;;;;;;;WOS:000766992600095;View Full Record in Web of Science
J;"Laukotka, FN; Krause, D";;;;"Laukotka, Fabian Niklas; Krause, Dieter";;;Supporting Digital Twins for the Retrofit in Aviation by a Model-Driven Data Handling;SYSTEMS;;;;;;;;;;;;;;;;;;Krause, Dieter/0000-0002-1253-1699;;;;;;;;;;;;;;2079-8954;;;;MAR;2023;11;3;;;;;;;142;10.3390/systems11030142;http://dx.doi.org/10.3390/systems11030142;;;;;;;;;;;;;WOS:000959876400001;View Full Record in Web of Science
J;"Parri, J; Patara, F; Sampietro, S; Vicario, E";;;;"Parri, Jacopo; Patara, Fulvio; Sampietro, Samuele; Vicario, Enrico";;;A framework for Model-Driven Engineering of resilient software-controlled systems;COMPUTING;;;;;;;;;;;;;;;;;vicario, enrico/ABG-4344-2020;"vicario, enrico/0000-0002-4983-4386; SAMPIETRO, SAMUELE/0000-0001-6684-1150; PARRI, JACOPO/0000-0001-5109-4375";;;;;;;;;;;;;0010-485X;1436-5057;;;;APR;2021;103;4;;;SI;;589;612;;10.1007/s00607-020-00841-6;http://dx.doi.org/10.1007/s00607-020-00841-6;;SEP 2020;;;;;;;;;;;WOS:000565499700001;View Full Record in Web of Science
C;"Bibow, P; Dalibor, M; Hopmann, C; Mainz, B; Rumpe, B; Schmalzing, D; Schmitz, M; Wortmann, A";;"Dustdar, S; Yu, E; Salinesi, C; Rieu, D; Pant, V";;"Bibow, Pascal; Dalibor, Manuela; Hopmann, Christian; Mainz, Ben; Rumpe, Bernhard; Schmalzing, David; Schmitz, Mauritius; Wortmann, Andreas";;;Model-Driven Development of a Digital Twin for Injection Molding;ADVANCED INFORMATION SYSTEMS ENGINEERING, CAISE 2020;Lecture Notes in Computer Science;;;;32nd International Conference on Advanced Information Systems Engineering (CAiSE);JUN 08-12, 2020;ELECTR NETWORK;;;;;;;;;;"; Rumpe, Bernhard/S-8216-2016";"Hopmann, Christian/0000-0003-4343-1508; Bibow, Pascal/0000-0002-9910-8702; Schmitz, Mauritius/0000-0002-1595-4881; Rumpe, Bernhard/0000-0002-2147-1966; Schmalzing, David/0000-0003-2041-1475; Dalibor, Manuela/0000-0002-1948-0556";;;;;;;;;;;;;0302-9743;1611-3349;"978-3-030-49435-3; 978-3-030-49434-6";;;;2020;12127;;;;;;85;100;;10.1007/978-3-030-49435-3_6;http://dx.doi.org/10.1007/978-3-030-49435-3_6;;;;;;;;;;;;;WOS:000716944400006;View Full Record in Web of Science
C;"Braunisch, N; Ristin-Kaufmann, M; Lehmann, R; Van de Venn, HW";;;IEEE;"Braunisch, Nico; Ristin-Kaufmann, Marko; Lehmann, Robert; van de Venn, Hans Wernher";;;Generative and Model-driven SDK development for the Industrie 4.0 Digital Twin;2021 26TH IEEE INTERNATIONAL CONFERENCE ON EMERGING TECHNOLOGIES AND FACTORY AUTOMATION (ETFA);IEEE International Conference on Emerging Technologies and Factory Automation-ETFA;;;;26th IEEE International Conference on Emerging Technologies and Factory Automation (ETFA);SEP 07-10, 2021;ELECTR NETWORK;Inst Elect & Elect Engineers,Malardalen Univ,IEEE Ind Elect Soc;;;;;;;;;;;;;;;;;;;;;;;1946-0740;1946-0759;978-1-7281-2989-1;;;;2021;;;;;;;;;;10.1109/ETFA45728.2021.9613164;http://dx.doi.org/10.1109/ETFA45728.2021.9613164;;;;;;;;;;;;;WOS:000766992600008;View Full Record in Web of Science
J;"Dalibor, M; Heithoff, M; Michael, J; Netz, L; Pfeiffer, J; Rumpe, B; Varga, S; Wortmann, A";;;;"Dalibor, Manuela; Heithoff, Malte; Michael, Judith; Netz, Lukas; Pfeiffer, Jerome; Rumpe, Bernhard; Varga, Simon; Wortmann, Andreas";;;Generating customized low-code development platforms for digital twins;JOURNAL OF COMPUTER LANGUAGES;;;;;;;;;;;;;;;;;"Michael, Judith/S-2844-2016; Michael, Judith/AAE-2646-2022";"Michael, Judith/0000-0002-4999-2544; Michael, Judith/0000-0002-4999-2544";;;;;;;;;;;;;2590-1184;2665-9182;;;;JUN;2022;70;;;;;;;;101117;10.1016/j.cola.2022.101117;http://dx.doi.org/10.1016/j.cola.2022.101117;;MAY 2022;;;;;;;;;;;WOS:000799842100001;View Full Record in Web of Science
J;"Vierhauser, M; Garmendia, A; Stadler, M; Wimmer, M; Cleland-Huang, J";;;;"Vierhauser, Michael; Garmendia, Antonio; Stadler, Marco; Wimmer, Manuel; Cleland-Huang, Jane";;;GRuM-A flexible model-driven runtime monitoring framework and its application to automated aerial and ground vehicles;JOURNAL OF SYSTEMS AND SOFTWARE;;;;;;;;;;;;;;;;;Stadler, Marco/IWE-4129-2023;Stadler, Marco/0000-0001-8790-6048;;;;;;;;;;;;;0164-1212;1873-1228;;;;SEP;2023;203;;;;;;;;111733;10.1016/j.jss.2023.111733;http://dx.doi.org/10.1016/j.jss.2023.111733;;MAY 2023;;;;;;;;;;;WOS:001002182500001;View Full Record in Web of Science
J;"Tzachor, A; Sabri, S; Richards, CE; Rajabifard, A; Acuto, M";;;;"Tzachor, Asaf; Sabri, Soheil; Richards, Catherine E.; Rajabifard, Abbas; Acuto, Michele";;;Potential and limitations of digital twins to achieve the Sustainable Development Goals;NATURE SUSTAINABILITY;;;;;;;;;;;;;;;;;"Sabri, Soheil/A-1702-2013; Sabri, Soheil/C-6103-2017";"Richards, Catherine/0000-0002-0084-0734; Sabri, Soheil/0000-0002-2167-2717; Acuto, Michele/0000-0003-4320-0531";;;;;;;;;;;;;2398-9629;;;;;OCT;2022;5;10;;;;;822;829;;10.1038/s41893-022-00923-7;http://dx.doi.org/10.1038/s41893-022-00923-7;;JUL 2022;;;;;;;;;;;WOS:000826853100001;View Full Record in Web of Science
J;"Visconti, E; Tsigkanos, C; Hu, ZJ; Ghezzi, C";;;;"Visconti, Ennio; Tsigkanos, Christos; Hu, Zhenjiang; Ghezzi, Carlo";;;Model-driven engineering city spaces via bidirectional model transformations;SOFTWARE AND SYSTEMS MODELING;;;;;;;;;;;;;;;;;;"Visconti, Ennio/0000-0002-1146-4850; Tsigkanos, Christos/0000-0002-9493-3404";;;;;;;;;;;;;1619-1366;1619-1374;;;;DEC;2021;20;6;;;;;2003;2022;;10.1007/s10270-020-00851-0;http://dx.doi.org/10.1007/s10270-020-00851-0;;FEB 2021;;;;;;34924920;;;;;WOS:000618190500001;View Full Record in Web of Science
C;Haverkort, BR;;"Abate, A; Marin, A";;Haverkort, Boudewijn R.;;;Performance Evaluation: Model-Driven or Problem-Driven?;QUANTITATIVE EVALUATION OF SYSTEMS (QEST 2021);Lecture Notes in Computer Science;;;;18th International Conference on Quantitative Evaluation Systems (QEST);AUG 23-27, 2021;ELECTR NETWORK;;;;;;;;;;;Haverkort, Boudewijn/0000-0002-0654-0740;;;;;;;;;;;;;0302-9743;1611-3349;"978-3-030-85172-9; 978-3-030-85171-2";;;;2021;12846;;;;;;3;11;;10.1007/978-3-030-85172-9_1;http://dx.doi.org/10.1007/978-3-030-85172-9_1;;;;;;;;;;;;;WOS:000696682500001;View Full Record in Web of Science
J;"Yang, XL; Liu, XM; Zhang, H; Fu, L; Yu, YB";;;;"Yang, Xiaolang; Liu, Xuemei; Zhang, Heng; Fu, Ling; Yu, Yanbin";;;Meta-model-based shop-floor digital twin architecture, modeling and application;ROBOTICS AND COMPUTER-INTEGRATED MANUFACTURING;;;;;;;;;;;;;;;;;;;;;;;;;;;;;;;0736-5845;1879-2537;;;;DEC;2023;84;;;;;;;;102595;10.1016/j.rcim.2023.102595;http://dx.doi.org/10.1016/j.rcim.2023.102595;;MAY 2023;;;;;;;;;;;WOS:001010343200001;View Full Record in Web of Science
J;"Liu, JF; Zhao, P; Jing, XW; Cao, XW; Sheng, SS; Zhou, HG; Liu, XJ; Feng, F";;;;"Liu, Jinfeng; Zhao, Peng; Jing, Xuwen; Cao, Xuwu; Sheng, Sushan; Zhou, Honggen; Liu, Xiaojun; Feng, Feng";;;Dynamic design method of digital twin process model driven by knowledge-evolution machining features;INTERNATIONAL JOURNAL OF PRODUCTION RESEARCH;;;;;;;;;;;;;;;;;"Lu, Xiaomei/IUQ-2139-2023; liu, qi/IQR-4870-2023; liu, xiao/HMD-7454-2023; Liu, Jing/IQX-0664-2023; liu, xiao/HKE-9880-2023; LIU, YU/HTR-1607-2023; Liu, Ying/ISU-1216-2023; yang, liu/HTN-9175-2023; zhang, yuyang/IVV-5089-2023";Liu, Jinfeng/0000-0003-1900-571X;;;;;;;;;;;;;0020-7543;1366-588X;;;;APR 3;2022;60;7;;;;;2312;2330;;10.1080/00207543.2021.1887531;http://dx.doi.org/10.1080/00207543.2021.1887531;;FEB 2021;;;;;;;;;;;WOS:000620056300001;View Full Record in Web of Science
C;"Gotz, S; Bucchiarone, A; Bencomo, N";;;IEEE COMP SOC;"Goetz, Sebastian; Bucchiarone, Antonio; Bencomo, Nelly";;;Preface of the 15th International Workshop on Models@run.time'21;24TH ACM/IEEE INTERNATIONAL CONFERENCE ON MODEL-DRIVEN ENGINEERING LANGUAGES AND SYSTEMS COMPANION (MODELS-C 2021);;;;;24th International ACM/IEEE Conference on Model-Driven Engineering Languages and Systems (MODELS);OCT 10-15, 2021;ELECTR NETWORK;IEEE,Assoc Comp Machinery,ACM SIGSOFT,IEEE Comp Soc,IEEE Tech Council Software Engn;;;;;;;;;"Bencomo, Nelly/GZL-1379-2022; Bucchiarone, Antonio/K-3128-2016";Bucchiarone, Antonio/0000-0003-1154-1382;;;;;;;;;;;;;;;978-1-6654-2484-4;;;;2021;;;;;;;183;183;;10.1109/MODELS-C53483.2021.00031;http://dx.doi.org/10.1109/MODELS-C53483.2021.00031;;;;;;;;;;;;;WOS:000749362300025;View Full Record in Web of Science
J;"Zhou, G; Zhou, K; Zhang, J; Yuan, M; Wang, XH; Feng, PF; Zhang, M; Feng, F";;;;"Zhou, Guo; Zhou, Kai; Zhang, Jing; Yuan, Meng; Wang, Xiaohao; Feng, Pingfa; Zhang, Min; Feng, Feng";;;Digital modeling-driven chatter suppression for thin-walled part manufacturing;JOURNAL OF INTELLIGENT MANUFACTURING;;;;;;;;;;;;;;;;;Feng, Feng/P-3640-2014;Feng, Feng/0000-0002-3960-7761;;;;;;;;;;;;;0956-5515;1572-8145;;;;2022 NOV 9;2022;;;;;;;;;;10.1007/s10845-022-02045-5;http://dx.doi.org/10.1007/s10845-022-02045-5;;NOV 2022;;;;;;;;;;;WOS:000880508300002;View Full Record in Web of Science
C;"Ma, X; Tao, F; Zhang, M; Wang, T; Zuo, Y";;"Huang, GQ; Qu, T; Thurer, M; Xu, S; Khalgui, M";;"Ma, Xin; Tao, Fei; Zhang, Meng; Wang, Tian; Zuo, Ying";;;Digital twin enhanced human-machine interaction in product lifecycle;11TH CIRP CONFERENCE ON INDUSTRIAL PRODUCT-SERVICE SYSTEMS;Procedia CIRP;;;;11th CIRP Conference on Industrial Product-Service Systems;MAY 29-31, 2019;PEOPLES R CHINA;Int Acad Prod Engn;;;;;;;;;"Tao, Fei/F-8944-2012; Ma, Xin/AAC-8751-2021; Zuo, Ying/Q-8298-2017";"Tao, Fei/0000-0002-9020-0633; Zuo, Ying/0000-0002-9067-3932";;;;;;;;;;;;;2212-8271;;;;;;2019;83;;;;;;789;793;;10.1016/j.procir.2019.04.330;http://dx.doi.org/10.1016/j.procir.2019.04.330;;;;;;;;;;;;;WOS:000568146700137;View Full Record in Web of Science
C;"Lehner, D; Wolny, S; Mazak-Huemer, A; Wimmer, M";;;IEEE;"Lehner, Daniel; Wolny, Sabine; Mazak-Huemer, Alexandra; Wimmer, Manuel";;;Towards a Reference Architecture for Leveraging Model Repositories for Digital Twins;2020 25TH IEEE INTERNATIONAL CONFERENCE ON EMERGING TECHNOLOGIES AND FACTORY AUTOMATION (ETFA);IEEE International Conference on Emerging Technologies and Factory Automation-ETFA;;;;25th IEEE International Conference on Emerging Technologies and Factory Automation (ETFA);SEP 08-11, 2020;Vienna, AUSTRIA;Inst Elect & Elect Engineers,IEEE Ind Elect Soc,TU Wien, Inst Comp Technol;;;;;;;;;;Sint, Sabine/0000-0001-8076-8228;;;;;;;;;;;;;1946-0740;1946-0759;978-1-7281-8956-7;;;;2020;;;;;;;1077;1080;;;;;;;;;;;;;;;;WOS:000627406500146;View Full Record in Web of Science
J;"Zhang, HM; Ren, DS; Ming, H; Zhang, WF; Cao, GP; Liu, JH; Wang, L; Song, JL; Qiu, JY; Wang, JL; He, XM; Zhang, H";;;;"Zhang, Huimin; Ren, Dongsheng; Ming, Hai; Zhang, Wenfeng; Cao, Gaoping; Liu, Jianhong; Wang, Li; Song, Junliang; Qiu, Jingyi; Wang, Jingliang; He, Xiangming; Zhang, Hao";;;Digital Twin Enables Rational Design of Ultrahigh-Power Lithium-Ion Batteries;ADVANCED ENERGY MATERIALS;;;;;;;;;;;;;;;;;"Wang, lili/IXD-9828-2023; Lu, Jianhong/IYT-3322-2023; Zhang, Yanfei/IXW-5406-2023; zhang, shuai/IVU-7877-2023";Ren, Dongsheng/0000-0002-8764-9819;;;;;;;;;;;;;1614-6832;1614-6840;;;;2022 NOV 11;2022;;;;;;;;;;10.1002/aenm.202202660;http://dx.doi.org/10.1002/aenm.202202660;;NOV 2022;;;;;;;;;;;WOS:000881637100001;View Full Record in Web of Science
C;"Su, JY; Meng, F; Liu, SH; Huang, YM; Lu, ZH";;;IEEE;"Su, Jingyi; Meng, Fan; Liu, Shengheng; Huang, Yongming; Lu, Zhaohua";;;Learning to Predict and Optimize Imperfect MIMO System Performance: Framework and Application;2022 IEEE GLOBAL COMMUNICATIONS CONFERENCE (GLOBECOM 2022);IEEE Global Communications Conference;;;;IEEE Global Communications Conference (GLOBECOM);DEC 04-08, 2022;Rio de Janeiro, BRAZIL;IEEE;;;;;;;;;Liu, Shengheng/S-1986-2017;Liu, Shengheng/0000-0001-6579-9798;;;;;;;;;;;;;2334-0983;2576-6813;978-1-6654-3540-6;;;;2022;;;;;;;335;340;;10.1109/GLOBECOM48099.2022.10001369;http://dx.doi.org/10.1109/GLOBECOM48099.2022.10001369;;;;;;;;;;;;;WOS:000922633500056;View Full Record in Web of Science
J;"Schade, S; Ogilvie, LA; Kessler, T; Schutte, M; Wierling, C; Lange, BM; Lehrach, H; Yaspo, ML";;;;"Schade, Sophia; Ogilvie, Lesley A.; Kessler, Thomas; Schuette, Moritz; Wierling, Christoph; Lange, Bodo M.; Lehrach, Hans; Yaspo, Marie-Laure";;;A data- and model-driven approach for cancer treatment;ONKOLOGE;;;;;;;;;;;;;;;;;;;;;;;;;;;;;;;0947-8965;1433-0415;;;;NOV;2019;25;;;2;SI;;132;137;;10.1007/s00761-019-0624-z;http://dx.doi.org/10.1007/s00761-019-0624-z;;;;;;;;;;;;;WOS:000496564700002;View Full Record in Web of Science
C;"Amar, B; Subhrojyoti, RC; Barnali, B; Dhakshinamoorthy, R; Seenivasan, A; Naveenkumar, S";;;IEEE;"Amar, B.; Subhrojyoti, R. C.; Barnali, B.; Dhakshinamoorthy, R.; Seenivasan, A.; Naveenkumar, S.";;;Knowledge driven rapid development of white box digital twins for industrial plant systems;IECON 2021 - 47TH ANNUAL CONFERENCE OF THE IEEE INDUSTRIAL ELECTRONICS SOCIETY;IEEE Industrial Electronics Society;;;;47th Annual Conference of the IEEE-Industrial-Electronics-Society (IECON);OCT 13-16, 2021;ELECTR NETWORK;IEEE Ind Elect Soc;;;;;;;;;;Banerjee, Amar/0000-0002-1454-4215;;;;;;;;;;;;;1553-572X;;978-1-6654-3554-3;;;;2021;;;;;;;;;;10.1109/IECON48115.2021.9589912;http://dx.doi.org/10.1109/IECON48115.2021.9589912;;;;;;;;;;;;;WOS:000767230604152;View Full Record in Web of Science
J;"Li, LH; Mao, CL; Sun, HX; Yuan, YP; Lei, BB";;;;"Li, Lianhui; Mao, Chunlei; Sun, Hongxia; Yuan, Yiping; Lei, Bingbing";;;Digital Twin Driven Green Performance Evaluation Methodology of Intelligent Manufacturing: Hybrid Model Based on Fuzzy Rough-Sets AHP, Multistage Weight Synthesis, and PROMETHEE II;COMPLEXITY;;;;;;;;;;;;;;;;;Versic, Ales/HCI-9826-2022;Lei, Bingbing/0000-0002-2337-1619;;;;;;;;;;;;;1076-2787;1099-0526;;;;JUL 16;2020;2020;;;;;;;;3853925;10.1155/2020/3853925;http://dx.doi.org/10.1155/2020/3853925;;;;;;;;;;;;;WOS:000556267900003;View Full Record in Web of Science
J;"Schade, S; Ogilvie, LA; Kessler, T; Schutte, M; Wierling, C; Lange, BM; Lehrach, H; Yaspo, ML";;;;"Schade, Sophia; Ogilvie, Lesley A.; Kessler, Thomas; Schuette, Moritz; Wierling, Christoph; Lange, Bodo M.; Lehrach, Hans; Yaspo, Marie-Laure";;;A data- and model-driven approach for cancer treatment. German version;ONKOLOGE;;;;;;;;;;;;;;;;;Kessler, Thomas/AAY-5497-2020;Wierling, Christoph/0000-0002-8856-8412;;;;;;;;;;;;;0947-8965;1433-0415;;;;SEP;2019;25;;;1;;;109;115;;10.1007/s00761-019-00652-1;http://dx.doi.org/10.1007/s00761-019-00652-1;;;;;;;;;;;;;WOS:000485322600015;View Full Record in Web of Science
J;"He, L; Wen, K; Gong, J; Wu, CC";;;;"He, Lei; Wen, Kai; Gong, Jing; Wu, Changchun";;;A multi-model ensemble digital twin solution for real-time unsteady flow state estimation of a pumping station;ISA TRANSACTIONS;;;;;;;;;;;;;;;;;;;;;;;;;;;;;;;0019-0578;1879-2022;;;;JUL;2022;126;;;;;;242;253;;10.1016/j.isatra.2021.08.021;http://dx.doi.org/10.1016/j.isatra.2021.08.021;;;;;;;;34493382;;;;;WOS:000827870700021;View Full Record in Web of Science
J;"Schroeder, GN; Steinmetz, C; Rodrigues, RN; Henriques, RVB; Rettberg, A; Pereira, CE";;;;"Schroeder, Greyce N.; Steinmetz, Charles; Rodrigues, Ricardo Nagel; Bayan Henriques, Renato Ventura; Rettberg, Achim; Pereira, Carlos Eduardo";;;A Methodology for Digital Twin Modeling and Deployment for Industry 4.0;PROCEEDINGS OF THE IEEE;;;;;;;;;;;;;;;;;Pereira, Carlos E/G-5280-2012;"Pereira, Carlos E/0000-0003-4315-4256; Steinmetz, Charles/0000-0001-6219-1816";;;;;;;;;;;;;0018-9219;1558-2256;;;;APR;2021;109;4;;;;;556;567;;10.1109/JPROC.2020.3032444;http://dx.doi.org/10.1109/JPROC.2020.3032444;;;;;;;;;;;;;WOS:000633393800012;View Full Record in Web of Science
J;Ji, SY;;;;Ji, Seung Yeul;;;Interactive Smart Space for Single-Person Households Using Electroencephalogram through Fusion of Digital Twin and Artificial Intelligence;ENERGIES;;;;;;;;;;;;;;;;;;;;;;;;;;;;;;;;1996-1073;;;;NOV;2021;14;22;;;;;;;7771;10.3390/en14227771;http://dx.doi.org/10.3390/en14227771;;;;;;;;;;;;;WOS:000806974700001;View Full Record in Web of Science
J;"Shen, XM; Gao, J; Wu, W; Li, MS; Zhou, CH; Zhuang, WH";;;;"Shen, Xuemin; Gao, Jie; Wu, Wen; Li, Mushu; Zhou, Conghao; Zhuang, Weihua";;;Holistic Network Virtualization and Pervasive Network Intelligence for 6G;IEEE COMMUNICATIONS SURVEYS AND TUTORIALS;;;;;;;;;;;;;;;;;"Shen, Xuemin/AAH-2564-2020; WU, WEN/ABH-3909-2020; Gao, Jie/AEN-2525-2022; Zhuang, Weihua/AAH-2576-2020";"Shen, Xuemin/0000-0002-4140-287X; WU, WEN/0000-0002-0458-1282; Gao, Jie/0000-0001-6095-2968; Zhuang, Weihua/0000-0003-0488-511X; Zhou, Conghao/0000-0002-5727-2432";;;;;;;;;;;;;;1553-877X;;;;;2022;24;1;;;;;1;30;;10.1109/COMST.2021.3135829;http://dx.doi.org/10.1109/COMST.2021.3135829;;;;;;;;;;;;;WOS:000763336500003;View Full Record in Web of Science
