Document Title;Abstract;Publication Title;Authors;Publication Year;Document Identifier;Publisher
A Digital Twin Model-Driven Architecture for Cyber-Physical and Human Systems;The cyber-physical and human system (CPHS) is widely recognized as a key infrastructure to support the future developments in healthcare, industrial manufacturing as well as in many other areas. In consequence, there is an increasing interest in tools, techniques, and technologies to advance the understanding and provide unchallenging improvement of CPHS. Digital Twin is a growing research topic that can equip the CPHS with high-fidelity mirroring, monitoring, controlling, and active functional improvement. The central question in this study asks in what way Digital Twin should be designed and developed for a CPHS. An architecture was required to answer this question and build upon model to define guidelines and requirements for valid Digital Twin. Thus, this study provides much new knowledge about the emerging role of Digital Twin in CPHS by using a model-driven architecture (MDA) approach with the perspective of SD logic. In addition, in the presence of human roles, the given MDA is beneficial for providing abstractions of Digital Twin from different viewpoints, communication with non-technical experts, and decision support, system design, and improvement. © 2023, The Author(s), under exclusive license to Springer Nature Switzerland AG.;Proceedings of the I-ESA Conferences;"Poursoltan M.; Traore M.K.; Pinède N.; Vallespir B.";2023;Conference paper;Springer Science and Business Media Deutschland GmbH
Model-driven engineering city spaces via bidirectional model transformations;"Engineering cyber-physical systems inhabiting contemporary urban spatial environments demands software engineering facilities to support design and operation. Tools and approaches in civil engineering and architectural informatics produce artifacts that are geometrical or geographical representations describing physical spaces. The models we consider conform to the CityGML standard; although relying on international standards and accessible in machine-readable formats, such physical space descriptions often lack semantic information that can be used to support analyses. In our context, analysis as commonly understood in software engineering refers to reasoning on properties of an abstracted model—in this case a city design. We support model-based development, firstly by providing a way to derive analyzable models from CityGML descriptions, and secondly, we ensure that changes performed are propagated correctly. Essentially, a digital twin of a city is kept synchronized, in both directions, with the information from the actual city. Specifically, our formal programming technique and accompanying technical framework assure that relevant information added, or changes applied to the domain (resp. analyzable) model are reflected back in the analyzable (resp. domain) model automatically and coherently. The technique developed is rooted in the theory of bidirectional transformations, which guarantees that synchronization between models is consistent and well behaved. Produced models can bootstrap graph-theoretic, spatial or dynamic analyses. We demonstrate that bidirectional transformations can be achieved in practice on real city models. © 2021, The Author(s).";Software and Systems Modeling;"Visconti E.; Tsigkanos C.; Hu Z.; Ghezzi C.";2021;Article;Springer Science and Business Media Deutschland GmbH
A New 5S Radar Structure Design Model Driven by Digital Twin;Digital Twin (DT) is acting as a key to realize Cyber-Physical System (CPS) supporting smart manufacturing. In radar community, ideal design description, poor dynamic interaction and limited implementation extension have significant impacts on effectiveness and efficiency of digital radar structure design. For addressing these shortfalls, a new 5S Radar Structure Design Model (5S-RSDM) driven by DT is proposed in this paper, whose composition, design optimization and design knowledge management are discussed. It shows that 5S-RSDM is helpful for persistent design optimization, efficient design knowledge management and significant radar SWaP decrease by creating a digital radar structure twin with dynamic interaction with the physical radar structure counterpart. © 2022, Science Press.;Lecture Notes in Electrical Engineering;"Deng D.; Ding X.; Wang L.";2022;Conference paper;Springer Science and Business Media Deutschland GmbH
Towards Reactive Planning with Digital Twins and Model-Driven Optimization;Digital Twins are emerging in several domains. They allow to connect various models with running systems based on bi-directional data exchange. Thus, design models can be extended with runtime views which also opens the door for many additional techniques such as identifying unexpected system changes during runtime. However, dedicated reactions to these unexpected changes, such as adapting an existing plan which has been computed in advance and may no longer be seen beneficial, are still often neglected in Digital Twins. To tackle this shortcoming, we propose so-called reactive planning that integrates Digital Twins with planning approaches to react to unforeseen changes during plan execution. In particular, we introduce an extended Digital Twin architecture which allows to integrate existing model-driven optimization frameworks. Based on this integration, we present different strategies how the replanning can be performed by utilizing the information and services available in Digital Twins. We evaluate our approach for a stack allocation case study. This evaluation yields promising results on how to effectively improve existing plans during runtime, but also allows to identify future lines of research in this area. © 2022, The Author(s), under exclusive license to Springer Nature Switzerland AG.;Lecture Notes in Computer Science (including subseries Lecture Notes in Artificial Intelligence and Lecture Notes in Bioinformatics);"Eisenberg M.; Lehner D.; Sindelar R.; Wimmer M.";2022;Conference paper;Springer Science and Business Media Deutschland GmbH
Model-Driven Engineering in Digital Thread Platforms: A Practical Use Case and Future Challenges;The increasing complexity delivered by the heterogeneity of the cyber-physical systems is being addressed and decoded by edge technologies, IoT development, robotics, digital twin engineering, and AI. Nevertheless, tackling the orchestration of these complex ecosystems has become a challenging problem. Specially the inherent entanglement of the different emerging technologies makes it hard to maintain and scale such ecosystems. In this context, the usage of model-driven engineering as a more abstract form of glue-code, replacing the boilerplate fashion, has improved the software development lifecycle, democratising the access to and use of the aforementioned technologies. In this paper, we present a practical use case in the context of Smart Manufacturing, where we use several platforms as providers of a high-level abstraction layer, as well as security measures, allowing a more efficient system construction and interoperability. © 2022, The Author(s).;Lecture Notes in Computer Science (including subseries Lecture Notes in Artificial Intelligence and Lecture Notes in Bioinformatics);"Chaudhary H.A.A.; Guevara I.; John J.; Singh A.; Ghosal A.; Pesch D.; Margaria T.";2022;Conference paper;Springer Science and Business Media Deutschland GmbH
Performance Evaluation: Model-Driven or Problem-Driven?;In this paper I address the divide that has emerged between the field of performance evaluation and the field of computer and communication system design. After looking back briefly on the history of the field, I subsequently reflect on the reasons why the field of performance evaluation has become so isolated. I then continue with a set of eight recommendations, based on my experience in performing projects with industry, that will help in reconnecting, and that will result in a better uptake of the newest techniques and tools in the field of design of computer and communication systems. Following these recommendations will probably push scientists a little out of their comfort zone, however, I feel the potential extra reward of seeing our work truly applied is more than worth it. © 2021, Springer Nature Switzerland AG.;Lecture Notes in Computer Science (including subseries Lecture Notes in Artificial Intelligence and Lecture Notes in Bioinformatics);Haverkort B.R.;2021;Conference paper;Springer Science and Business Media Deutschland GmbH
Towards Development Platforms for Digital Twins: A Model-Driven Low-Code Approach;Digital Twins in smart manufacturing must be highly adaptable for different challenges, environments, and system states. In practice, there is a need for enabling the configuration of Digital Twins by domain experts. Low-code approaches seem to be a meaningful solution for configuration purposes but often lack extension options. We propose a model-driven low-code approach for the configuration and reconfiguration of Digital Twins using language plugins. This approach uses model-driven software engineering and software language engineering methods to derive a configurable digital twin implementation. Moreover, we discuss some remaining challenges such as interoperability, language modularity, evolution, integration of assistive services, collaborative development, and web-based debugging. © 2021, IFIP International Federation for Information Processing.;IFIP Advances in Information and Communication Technology;"Michael J.; Wortmann A.";2021;Conference paper;Springer Science and Business Media Deutschland GmbH
Applying a Healthcare Web of Things Framework for Infertility Treatments;According to doctors and researchers, fertility problems are becoming epidemic proportions. Meanwhile, the demand for infertility treatment is increasing by 5–10% per year. To support the growing demand, physicians need to define personalized remote monitoring treatments supported by devices that send real-time information on hormones levels, heart-rate, temperature, etc. To this end, Healthcare Monitoring Systems (HMS) have recently appeared, based on increasingly advanced devices that help to manage this task. However, current solutions are expensive and not very customizable by physicians themselves. In this paper, we propose a framework called MoSTHealth, based on digital twins and Model-Driven Engineering (MDE), allows healthcare experts to model a personalized Web of Things (WoT) HMS scenario per treatment and per patient. Thanks to MDE, the simulated scenario allows us to generate a Service-Oriented enterprise cloud architecture that integrates a prediction module based on machine learning and data analysis. In this paper, a WoT HMS scenario for infertility treatment is presented as a case study. In this scenario, a specific care plan is defined, associated with a set of devices, including the use of a biosensing device that sends hormones levels in real-time. © 2022, Springer Nature Switzerland AG.;Lecture Notes in Computer Science (including subseries Lecture Notes in Artificial Intelligence and Lecture Notes in Bioinformatics);"Gorelova A.; Meliá S.";2022;Conference paper;Springer Science and Business Media Deutschland GmbH
Towards a Model-Driven Architecture for Interactive Digital Twin Cockpits;Digital twins promise tremendous potential to reduce time and cost in the smart manufacturing of Industry 4.0. Engineering and monitoring interactive digital twins currently demands integrating different piecemeal technologies that effectively hinders their application and deployment. Current research on digital twins focuses on specific implementations or abstract models on how digital twins could be conceived. We propose model-driven software engineering to realize interactive digital twins and user-specific cockpits to interact with the digital twin by generating the infrastructure from common data structure models. To this end, we present a model-driven architecture for digital twins, its integration with an interactive cockpit, and a systematic method of realizing both. Through this, modeling, deploying, and monitoring interactive digital twins becomes more feasible and fosters their successful application in smart manufacturing. © 2020, Springer Nature Switzerland AG.;Lecture Notes in Computer Science (including subseries Lecture Notes in Artificial Intelligence and Lecture Notes in Bioinformatics);"Dalibor M.; Michael J.; Rumpe B.; Varga S.; Wortmann A.";2020;Conference paper;Springer Science and Business Media Deutschland GmbH
Dynamic design method of digital twin process model driven by knowledge-evolution machining features;Machining plan is the core of guiding manufacturing production and is regarded as one of the keys to ensure the quality of product processing. Existing process design methods are inefficient to quickly handle the machining plan changed induced by the unpredictable events in real-time production. It inevitably causes time and economic losses for the enterprise. In order to express the evolutionary characteristics of product processing, the construction method of digital twin process model (DTPM) is proposed based on the knowledge-evolution machining features. Three key technologies include correlation structure of process knowledge, expression method of the evolution geometric features and the association mechanism between two are solved. On this basis, the construction framework of DTPM is illustrated. Then, the organisation and management mechanism of multi-source heterogeneous data is discussed in detail. At last, a case study of the complex machined part is researched, the results show that the processing time reduced by about 7% and the processing stability improved by 40%. Meanwhile, the implementation scheme, application process and effect of this case are described in detail to provide reference for enterprises. © 2021 Informa UK Limited, trading as Taylor & Francis Group.;International Journal of Production Research;"Liu J.; Zhao P.; Jing X.; Cao X.; Sheng S.; Zhou H.; Liu X.; Feng F.";2022;Article;Taylor and Francis Ltd.
The Research of Aero-engine Digital Twin Model Based on Model-driven and Data-driven Fusion Method;With the rapid development of multi-field physical modeling, sensor network, big data processing and analysis and other information technologies, digital twin technology is gradually applied in the field of complex equipment operation and maintenance. Aero-engine is a typical complex equipment. The accurate monitoring in operation and performance degradation assessment and prediction are the key problems in maintenance. According to the definition of digital, the paper puts forward the concept of aero-engine digital twin and constructs an aero-engine digital twin model based on precise physical models, historical data and sensors data. The aero-engine digital twin model can predict the physical properties and can be applied to accurate monitoring in operation and performance degradation assessment and prediction.;2021 IEEE 10th Data Driven Control and Learning Systems Conference (DDCLS);"K. Liu; P. Wang; Q. Li";2021;IEEE Conferences;IEEE
Generative and Model-driven SDK development for the Industrie 4.0 Digital Twin;Industrie 4.0 maps the digital twin as the Asset Administration Shell. To develop this digital twin, the Asset Administration Shell meta-model is used. A developer needs high-quality libraries in their programming languages to build the Asset Administration Shell in efficient and ergonomic way. The existing representations of the meta-model are inconvenient for moving from the specification to realizations in software development. This leads to many, often manual, re-implementations of the Asset Administration Shell in each programming language. We present an approach to automatically generate libraries based on the intermediate representation of the meta-model. The approach allows for practical and simple development process of Industrie 4.0 components, and scales across programming environments and future changes in the meta-model.;2021 26th IEEE International Conference on Emerging Technologies and Factory Automation (ETFA );"N. Braunisch; M. Ristin-Kaufmann; R. Lehmann; H. W. van de Venn";2021;IEEE Conferences;IEEE
Towards a Reference Architecture for Leveraging Model Repositories for Digital Twins;"In the area of Cyber-Physical Systems (CPS), the degree of complexity continuously increases mainly due to new key-enabling technologies supporting those systems. One way to deal with this increasing complexity is to create a digital representation of such systems, a so-called Digital Twin (DT), which virtually acts in parallel ideally across the entire life-cycle of a CPS. For this purpose, the DT uses simulated or real-time data to mimic operations, control, and may modify the CPS’s behaviour at runtime. However, building such DTs from scratch is not trivial, mainly due to the integration needed to deal with heterogeneous systems residing in different technological spaces. In order to tackle this challenge, Model-Driven Engineering (MDE) allows to logically model a CPS with its physical components. Usually, in MDE such ""logical models"" are created at design time which keep them detached from the deployed system during runtime. Instead of building bilateral solutions between each runtime environment and every engineering tool, a dedicated integration layer is needed which can deal with both, design and runtime aspects. Therefore, we present a reference architecture that allows on the one side to query data from model repositories to enrich the running system with design-time knowledge, and on the other side, to be able to reasoning about system states at runtime in design-time models. We introduce a model repository query and management engine as mediator and show its feasibility by a demonstration case.";2020 25th IEEE International Conference on Emerging Technologies and Factory Automation (ETFA);"D. Lehner; S. Wolny; A. Mazak-Huemer; M. Wimmer";2020;IEEE Conferences;IEEE
Digital Twin Operational Platform for Connectivity and Accessibility using Flask Python;This paper demonstrates an example of an open-source, modular, and system independent framework that has been developed by a team of researchers working for the UK based DigiTwin project. The example in this paper is based on a framework for a digital twin operational platform (DTOP) that uses Flask Python, and is named DTOP-Cristallo. DTOPCristallo is an operational platform that uses HTML web pages as the interface between the digital twin simulations, both python based and 3rd party software based, and the user. This framework is particularly useful for connectivity with users, since it can deploy the digital twin with multiple accessibility options to accommodate a wide variety of intended uses.;2021 ACM/IEEE International Conference on Model Driven Engineering Languages and Systems Companion (MODELS-C);"M. S. Bonney; M. de Angelis; D. Wagg; M. D. Borgo";2021;IEEE Conferences;IEEE
Data- and model-driven digital twins for design and logistics control of product distribution;Digital control of product-on-pallet distribution is organized on two layers in logistics systems: the low-level local process automation and the supervision and coordination dual logistic execution system. The paper's scientific contribution consists in a holonic control system for multiple robot palletizing cells for product-on-pallet distribution. In this holonic control approach, data-driven digital twins (DT) are created to optimize palletizing schedules, controlled with situation awareness and resource health monitoring. A model-driven DT configuration with embedded simulation faster than real-time is combined with the data-driven DT in a meta-level control scheme offering predictive situation awareness. The paper also presents a pure model-driven DT mock-up of a robot palletizing cell - simulation with software in the loop - in which the actual holonic control system including digital twins and decision making is used in the simulation as it will be deployed in reality. This configuration is used to design the robot palletizing cells, to experiment in limit conditions, to fine tune and validate the robot control solution.;2021 23rd International Conference on Control Systems and Computer Science (CSCS);"M. Stan; T. Borangiu; S. Răileanu";2021;IEEE Conferences;IEEE
A software engineering point of view on digital twin architecture;Digital twins, along with Internet of Things and Artificial Intelligence, have been identified as one of the key technologies for Industry 4.0. However, the definition of Digital Twin (DT) is still abstract and context-dependent. In this paper, we present a metamodel that supports concrete and operational descriptions of digital twin deployment. This metamodel encompasses the different aspects of deployment, including the definition of hardware and software components that compose the layered cyber-physical architectures of the digital twin, along with the installation and instantiation tasks that compose deployment processes. Multiple configurations can also be defined to support the deployment of a digital twin in different execution contexts. The relevance of this metamodel was evaluated by two case studies. The first consists in deploying the digital twin of a cobot in a simulation environment. The second applies the approach in a home automation environment. In both cases, our metamodel provides complete and precise descriptions of the deployment process and thus constitutes a viable first step towards a model-driven approach for digital twin deployment.;2022 IEEE 27th International Conference on Emerging Technologies and Factory Automation (ETFA);"G. Béchu; A. Beugnard; C. G. L. Cao; Q. Perez; C. Urtado; S. Vauttier";2022;IEEE Conferences;IEEE
Process Prediction with Digital Twins;Process discovery from event logs as well as process prediction using process models at runtime are increasingly important aspects to improve the operation of digital twins of complex systems. The integration of process mining functionalities with model-driven digital twin architectures raises the question which models are important for the model-driven engineering of digital twins at designtime and at runtime. Currently, research on process mining and model-driven digital twins is conducted in different research communities. Within this position paper, we motivate the need for the holistic combination of both research directions to facilitate harnessing the data and the models of the systems of the future at runtime. The presented position is based upon continuous discussions, workshops, and joint research between process mining experts and software engineering experts in the Internet of Production excellence cluster. We aim to motivate further joint research into the combination of process mining techniques with model-driven digital twins to efficiently combine data and models at runtime.;2021 ACM/IEEE International Conference on Model Driven Engineering Languages and Systems Companion (MODELS-C);"T. Brockhoff; M. Heithoff; I. Koren; J. Michael; J. Pfeiffer; B. Rumpe; M. S. Uysal; W. M. P. Van Der Aalst; A. Wortmann";2021;IEEE Conferences;IEEE
AML4DT: A Model-Driven Framework for Developing and Maintaining Digital Twins with AutomationML;As technologies such as the Internet of Things (IoT) and Cyber-Physical Systems (CPS) are becoming ubiquitous, systems adopting these technologies are getting increasingly complex. Digital Twins (DTs) provide comprehensive views on such systems, the data they generate during runtime, as well as their usage and evolution over time. Setting up the required infrastructure to run a Digital Twin is still an ambitious task that involves significant upfront efforts from domain experts, although existing knowledge about the systems, such as engineering models, may be already available for reuse. To address this issue, we present AML4DT, a model-driven framework supporting the development and maintenance of Digital Twin infrastructures by employing AutomationML (AML) models. We automatically establish a connection between systems and their DTs based on dedicated DT models. These DT models are automatically derived from existing AutomationML models, which are produced in the engineering phases of a system. Additionally, to alleviate the maintenance of the DTs, AML4DT facilitates the synchronization of the AutomationML models with the DT infrastructure for several evolution cases. A case study shows the benefits of developing and maintaining DTs based on AutomationML models using the proposed AML4DT framework. For this particular study, the effort of performing the required tasks could be reduced by about 50%.;2021 26th IEEE International Conference on Emerging Technologies and Factory Automation (ETFA );"D. Lehner; S. Sint; M. Vierhauser; W. Narzt; M. Wimmer";2021;IEEE Conferences;IEEE
