Document Title;Abstract;Publication Title;Authors;Publication Year;Document Identifier;Publisher
Twin Process Model Driven Machining Quality Optimization for Complex Parts;Machining process of complex parts is high-performance processing with equal emphasis on geometric accuracy and physical performance indicators, and its machining quality directly affects service performance. Process optimization based on digital twin is considered as an intelligent method to link machining process and process design, which is benefit to the scientific control of machining quality. This paper summarizes the evolution and development of process model and proposes twin process model, which could support the machining quality optimization of complex parts. What’s more, industrial application of twin process model is introduced through three steps, namely mapping relationship between machine operation data and instruction domain, simulation and monitoring of machining surface roughness, and optimization of machining parameter based on twin process model. Finally, the proposed twin process model could provide theoretical support for machining quality control.;2021 International Conference on Digital Society and Intelligent Systems (DSInS);"J. Li; G. Zhou; C. Zhang";2021;IEEE Conferences;IEEE
Multisource Model-Driven Digital Twin System of Robotic Assembly;"The digital twin technology effectively fuels improvements in the quality and efficiency of robotic assembly, especially for sophisticated processes. High-quality digitalization requires a comprehensive description and real-time rendering of system, which are challenging. This article aims to demonstrate a novel multisource model-driven digital twin system, which is based on the geometric, physics, and sequential rule descriptions for producing a precise and real-time simulation of a robotic assembly system. In our system, the digital counterpart rendered with virtual reality technology is created and updated by the real environment information. A 3-D graphic model is reconstructed first using the geometric information of surroundings captured by the depth sensor. During interaction, a fast and efficient approach is proposed to generate the contact force and render the object deformation in the virtual environment. The virtual space also provides the sequential rule that is based on the danger field, which helps to constrain the operation of digital twin. At last, the experimental platform is established in which the virtual space is at an update rate of 100 Hz, while the automatic sorting task is performed and verified; the results show the effectiveness and applicability of the method to digital twin system.";IEEE Systems Journal;"X. Li; B. He; Y. Zhou; G. Li";2021;IEEE Journals;IEEE
Semantic Interoperability of Digital Twins: Ontology-based Capability Checking in AAS Modeling Framework;Industry 4.0 currently prepares a major shift towards extreme flexibility into production lines management. Digital Twins are one of the key enabling technologies for Industry 4.0. However, the interoperability gap among digital representation of Industry 4.0 assets is still one of the obstacles to the development and adoption of digital twins. If the Asset Administration Shell (AAS), the standard proposed to represent the I4.0 components, caters for syntactic interoperability, a more semantic kind of interoperability is deeply needed to develop flexible and adaptable production lines. In our work, we overcome the limitation of current syntactic-only resource matching algorithms by implementing semantic interoperability based on ontologies i.e., by transforming AAS-based plant models into MaRCO (Manufacturing Resource Capability Ontology) instances and then query the expanded ontology to find the needed resources. This article presents this ontology-based approach as the first step towards the design and implementation of an automated I4.0 flexible plant supervision and control system based on model-driven engineering (MDE) within the “Papyrus for Manufacturing” toolset. We show how an MDE approach can aggregate around digital twin modeling tools from the Papyrus platform both I4.0 technologies and AI (Knowledge Representation and Reasoning) tools. Our platform aligns modeling and ontological elements to get the best of both worlds. This method has two main advantages: (1) to provide semantic descriptions for digital twin models, (2) to complement model-driven engineering tools with automated reasoning. This paper showcases this approach through a robotic cell use case.;2023 IEEE 6th International Conference on Industrial Cyber-Physical Systems (ICPS);"Y. Huang; S. Dhouib; L. P. Medinacelli; J. Malenfant";2023;IEEE Conferences;IEEE
A Lightweight Model-driven MES Simulation Framework Based On Probabilistic Finite Automata;"In recent years, the concept of digital twin was introduced to the field of intelligent manufacturing. People use simulation technologies to complete the process of physical equipment in virtual space. As the manager of production process data, MES system is an important basis of digital twin in industrial production. Current MES systems are mostly developed for specific domains, often for large enterprises, with high coupling and poor scalability, which are difficult to be applied to smaller production enterprises with low informationization degree. In this paper, we propose a lightweight model-driven MES simulation framework that uses probabilistic finite automata to form a fast modeling for factory as well as to generate production data, and achieves a highly flexible production process simulation through config files; the framework could also be used to build a real MES system for small and medium-sized production enterprises.";2022 7th International Conference on Intelligent Computing and Signal Processing (ICSP);"K. Zhang; J. Tian; J. Han; Q. Yuan";2022;IEEE Conferences;IEEE
Digital Twin of an Electrical Motor Based on Empirical Performance Model;The concept of Digital Twin is creating and maintaining a digital representation of the real physical entity and supporting its performance utilizing simulation and optimization tools, which are fed with real data. Development and implementation of Digital Twin technology is a hot topic in many industry-oriented research projects. However, more detailed studies are needed on design methods for Digital Twins, which allows full synchronization and connectivity between virtual and real environments. This paper presents a development case study of Digital Twin for an electric motor based on an empirical performance model. The paper discusses the way how the data required for the Digital Twin were obtained and present a detailed structural description of the virtual entity. Unity3D is used for physics simulations and visualization of the Digital Twin, because of simple accessible and meticulously detailed documentation highly useful for rapid prototyping in early stages.;2020 XI International Conference on Electrical Power Drive Systems (ICEPDS);"A. Rassõlkin; V. Rjabtšikov; T. Vaimann; A. Kallaste; V. Kuts; A. Partyshev";2020;IEEE Conferences;IEEE
Closed-Loop Systems Engineering (CLOSE): Integrating Experimentable Digital Twins with the Model-Driven Engineering Process;A particular problem in the practical application of Model-Based Systems Engineering (MBSE) for the development of complex products is the effective integration of other engineering models. The Model-Driven Engineering Process (MDEP) addresses this by providing clearly defined insert points for domain models and simulation engines. In Closed-Loop Systems Engineering (CLOSE) Experimentable Digital Twins (EDTs) are integrated in the MDEP to realistically simulate how system functions would be executed by physical parts of the developed product. CLOSE thus can reduce the cycle times for analysis, design, development, optimisation, and some of the verification. This paper introduces the basic concept of CLOSE and illustrates its application with a case study.;2018 IEEE International Systems Engineering Symposium (ISSE);"M. D. Maio; G. -D. Kapos; N. Klusmann; L. Atorf; U. Dahmen; M. Schluse; J. Rossmann";2018;IEEE Conferences;IEEE
Research on Modeling Method of System Reliability Digital Twin;In view of the problems existing in the current product development, such as poor coordination of system Reliability work, lack of effective model representation methods and supporting data, combined with the advantages of digital twin in model-driven and data-driven integration, and the requirements of Reliability integrated design, an system reliability digital twin model construction method is proposed, combines Reliability and functional characteristics elements. The concept of Reliability digital twin is defined, and the relationship between Reliability digital twin and MBSE-based Reliability is analyzed. Based on this, the construction process of product system Reliability digital twin model is given, the objects, basic models and data of relevant stages in the process are defined, and the construction idea and related basic models representation methods of system Reliability digital twin model are put forward. Finally, a case study of the power subsystem of a communication system is carried out, which lays an important foundation for the realization of forward design of product reliability based on digital twin.;2021 2nd International Conference on Electronics, Communications and Information Technology (CECIT);"H. Yang; Z. Lai; Y. Liu; N. Hu; B. Diao; Y. Pan";2021;IEEE Conferences;IEEE
Improved Electric Vehicle Digital Twin Performance Incorporating Detailed Lithium-ion Battery Model;Electric Vehicle numbers have rapidly increased over the past decade. There is a dire need to establish accurate simulation frameworks to model the Electric Vehicle performance. Multiple simulation model-based approaches have been proposed in literature which consider the impact of various drive cycles on vehicle characteristics. All the available Electric Vehicle simulation models available in literature use lumped battery parameters which do not capture the dynamic behaviour of the vehicle. A detailed battery model considering drive cycle dynamics In Electric Vehicle Digital Twins have not been explored by researchers. This paper aims to provide tangible EV performance characteristics accounting for detailed 2RC battery model. This paper has used a two wheeler drive characteristics driven by a 2 kW Brushless Direct Current Motor powered by a 3.2 kWh battery pack. This paper also compares the variations in battery parameters with the lumped battery model to highlight the advantages of the proposed approach.;2022 IEEE International Conference on Electronics, Computing and Communication Technologies (CONECCT);"A. Sahoo; S. Sahithi; J. Channegowda";2022;IEEE Conferences;IEEE
Workshop Management and Control System Based on Digital Twin;Aiming at the connotation and characteristics of digital twin, and improving the level of informatization and intelligence of the workshop, a workshop management and control system based on digital twins is proposed, which can realize the management and control of the full life cycle of digital twins. Based on the physical production line model of the digital twin, the virtual and real joint debugging method of the digital twin workshop is constructed: the controller controls the virtual model, and the virtual model drives the simulation. The operation and control model of the digital twin is driven through the communication framework of OPC UA (Object Linking and Embedding for Process Unified Architecture), and the virtual and real interaction of the physical production line is used to timely reflect the operation of the workshop. From model building, model digital drive, virtual and real control joint debugging, to full life cycle workshop verification and design simulation, the visual monitoring of the digital twin workshop is finally realized.;2022 8th International Conference on Control, Automation and Robotics (ICCAR);"G. Wang; Z. Bing; Z. Hou; Y. Guan; X. Qi; M. Liu";2022;IEEE Conferences;IEEE
Using UML and OCL Models to Realize High-Level Digital Twins;Digital twins constitute virtual representations of physically existing systems. However, their inherent complexity makes them difficult to develop and prove correct. In this paper we explore the use of UML and OCL, complemented with an executable language, SOIL, to build and test digital twins at a high level of abstraction. We also show how to realize the bidirectional connection between the UML models of the digital twin in the USE tool with the physical twin, using an architectural framework centered on a data lake. We have built a prototype of the framework to demonstrate our ideas, and validated it by developing a digital twin of a Lego Mindstorms car. The results allow us to show some interesting advantages of using high-level UML models to specify virtual twins, such as simulation, property checking and some other types of tests.;2021 ACM/IEEE International Conference on Model Driven Engineering Languages and Systems Companion (MODELS-C);"P. Muñoz; J. Troya; A. Vallecillo";2021;IEEE Conferences;IEEE
Interface Development for Digital Twin of an Electric Motor Based on Empirical Performance Model;The concept of Digital Twin is creating and maintaining a digital representation of the real physical entity and supporting its performance utilizing simulation and optimization tools, which are fed with the real data obtained from the physical equipment. Development and implementation of the Digital Twin technology are one of the main challenges for today’s industry, more detailed studies are needed on design methods for Digital Twins. Besides using Digital Twin as a high-quality simulation, one of the commitments is monitoring and maintaining control of the whole system via a constant live link between virtual and physical entities. The related research study presents a detailed structural description of the developed Digital Twin virtual entity and the development of a framework that allows Robot Operating System (ROS) to securely communicate with remote Digital Twins via the Internet and harness ROS’s adaptability across vast distances and multiple systems. This paper is an extended version of the authors’ International Conference on Electrical Power Drive Systems (ICEPDS20) paper, in which we propose a development case study of Digital Twin for an electric motor based on an empirical performance model.;IEEE Access;"A. Rassõlkin; V. Rjabtšikov; V. Kuts; T. Vaimann; A. Kallaste; B. Asad; A. Partyshev";2022;IEEE Journals;IEEE
A Model-Driven Approach for Situational Intelligence & Operational Awareness;In order to design, operate, and maintain an oil and gas facility, one must first understand its behavior. A model-driven engineering and operation solution is required to analyze and identify problems early on and then improve design to ensure further problems are less likely. Predictive models are already shaping our experiences. They recommend products and services based on our habits. Predictive models of electrical power networks serve as a “digital twin” of the system including network topology, engineering parameters, and other pertinent information with real-time data acquired for depicting the actual operation of the system. A clear and thorough understanding of the operational system increases uptime and reduces the number of unnecessary shutdowns. Predictive simulation models help engineers and operators increase their understanding of systems in a cost-effective and repeatable environment by offering Situational Intelligence & Automation. This paper will include the benefits of adding such a system, the challenges that must be overcome and the lessons that have been learned from the implementation of several of these systems. It will also serve as a handbook on justification for a model-driven power management and automation of oil and gas facilities.;2019 Petroleum and Chemical Industry Conference Europe (PCIC EUROPE);"S. Shokooh; G. Nordvik";2019;IEEE Conferences;IEEE
Knowledge driven rapid development of white box digital twins for industrial plant systems;Industrial systems like power plants need a significant domain and engineering expertise for their efficient operations. Experts make decisions for multiple operational objectives such as minimizing cost, maximizing productivity, ensuring compliance to environmental conditions, etc. However, deciding strategies to achieve an objective can be highly non-trivial as it may lead to conflicting outcomes concerning other objectives. Modern digital twin(DT) technologies make it possible to build systems to support such decision-making to validate critical decisions. DTs are developed as one-off solutions for individual plants in the current practice, requiring high efforts and domain knowledge. Our work demonstrates the use of a knowledge-driven approach to reduce DT development efforts significantly. The main contribution of our work is an end-to-end architecture that allows us to explicate, structure, and reuse domain knowledge to semi-automate DT development for industrial plants. We integrate technologies like semantic web, model-driven engineering, and formal methods to realize the architecture. Our approach to developing a DT supporting a fault management scenario in a power plant reduced 70% development time and 50% manual efforts.;IECON 2021 – 47th Annual Conference of the IEEE Industrial Electronics Society;"A. B.; S. R.C.; B. B.; R. Dhakshinamoorthy; S. A.; N. S.";2021;IEEE Conferences;IEEE
Interface Management with Closed-Loop Systems Engineering (CLOSE);Interfaces (IF) and their Management (IFM) are a particular challenge in the successful development of complex products and products operating in a complex environment. In Closed-Loop Systems Engineering (CLOSE) IFM is fully integrated into its Model-Driven Engineering Process (MDEP). CLOSE provides fully automated IF modelling, traceable IF history, an efficient handling of IF negotiations and the effective de-coupling of interfacing systems. Especially in combination with CLOSE's Experimentable Digital Twins (EDTs), IFM becomes a vital resource for the development process, rather than the parallel process it so often is today, supporting early variant evaluation, balance checks and impact analysis, which makes it a central asset for developing better products. This paper describes IFM in CLOSE and illustrates it with a case study of a Martian robot for autonomous scientific missions.;2018 IEEE International Systems Engineering Symposium (ISSE);"M. Di Maio; L. Atorf; U. Dahmen; M. Schluse; J. Rossmann; M. Hoppe; G. -D. Kapos";2018;IEEE Conferences;IEEE
Urban Intelligence: Toward the Digital Twin of Matera and Catania;The Urban Intelligence (UI) paradigm conceived by CNR consists of an ecosystem of digital technologies joined within a Digital Twin (DT) of the city aimed at improving the city governance towards goals addressed also by the UN Agenda 2030, such as urban environment, sustainability and resilience, wellbeing and quality of life, local development, and social inclusion. In particular, UI provides a set of candidate policies in complex scenarios, and supports policy makers and stakeholders in designing shared, evidence-based, and integrated solutions. UI is being applied for the first time to two Italian cities, Matera and Catania, paving the way for a deeper scientific framing of the paradigm, as well as for the technological development and testing of the core UI ecosystem in real-life situations. The paper introduces the UI key-concepts and components, illustrates the ongoing experimentations in these pilot cities related to the development of two DTs on parts of the urban areas, and presents some initial results.;2022 Workshop on Blockchain for Renewables Integration (BLORIN);"G. Castelli; A. Cesta; M. Ciampi; R. De Benedictis; G. De Pietro; M. Diez; G. Felici; R. Malvezzi; B. Masini; R. Pellegrini; A. Scalas; G. Stecca; L. Strambini; G. Tognola; P. Ravazzani; E. F. Campana";2022;IEEE Conferences;IEEE
Developing a Physical and Digital Twin: An Example Process Model;As a result of the fast development of technologies and diversity of requirements, complexity exists not only in a system itself but also in the development process and environment. The complexity in the development process comes from specialization and concurrency, and a Digital Twin (DT) has the potential to mitigate these issues. We hope, during the process of building a DT, the accidental complexity can be minimized by application of model-based systems engineering and the Multi-Paradigm Modeling (MPM). In this paper, we give an example of the process of building a DT combined with a process model. Our long term goal is to model the development of various DTs to identify the commonalities and variations across multiple DTs.;2021 ACM/IEEE International Conference on Model Driven Engineering Languages and Systems Companion (MODELS-C);"H. Feng; C. Gomes; M. Sandberg; C. Thule; K. Lausdahl; P. G. Larsen";2021;IEEE Conferences;IEEE
Combining Low-Code Programming and SDL-Based Modeling with Snap! in the Industry 4.0 Context;One of the main challenges to implement Industry 4.0 technologies within the industrial fabric is the lack of suitable concrete models and tools that demonstrate the potential benefits of embracing the digital transformation process. To overcome this challenge, over the past years, various Industry 4.0 automation and robotics providers have presented solutions based on visual block programming languages, which follow an emerging low-code approach to reduce the entry barriers of digital technologies. However, block-based low-code tools typically lack the formality introduced by specification languages, limiting their ability to model the industrial processes formally. Taking this into account, in this article, we present the combination of specification languages and visual block programming languages to enable industrial users to test and/or build their own Digital Twin models at a suitable abstraction level and with low entry barriers. In particular, we combine SDL and Snap! to create SDL4Snap!, an open-source and web-based tool that facilitates the implementation and validation of Digital Twin prototypes. Overall, the resulting tool has the potential to reduce the entry barrier to Digital Twins in small and medium enterprises, which are part of the late majority and laggard groups regarding the adoption of digital technologies in the context of Industry 4.0.;2021 ACM/IEEE International Conference on Model Driven Engineering Languages and Systems Companion (MODELS-C);"X. P. i. Palomés; P. Tuset-Peiró; P. F. i. Casas";2021;IEEE Conferences;IEEE
A Methodology for Digital Twin Modeling and Deployment for Industry 4.0;"The digital twin (DT) is a virtual representation of a physical object, which has been proposed as one of the key concepts for Industry 4.0. The DT provides a virtual representation of products along their lifecycle that enables the prediction and optimization of the behavior of a production system and its components. A methodology design using model-driven engineering (MDE) is proposed that strives toward being both flexible and generic. This approach is presented at two levels: first, a DT is modeled as a composition of basic components that provide basic functionalities, such as identification, storage, communication, security, data management, human-machine interface (HMI), and simulation; second, an aggregated DT is defined as a hierarchical composition of other DTs. A generic reference architecture based on these concepts and a concrete implementation methodology are proposed using AutomationML. This methodology follows an MDE approach that supports most of the DT features currently proposed in the literature. A case study has been developed, the proposed ideas are being evaluated with industrial case studies, and some of the preliminary results are described in this article. With the case study, it is possible to verify that the proposed methodology supports the creation and the deployment process of a DT.";Proceedings of the IEEE;"G. N. Schroeder; C. Steinmetz; R. N. Rodrigues; R. V. B. Henriques; A. Rettberg; C. E. Pereira";2021;IEEE Journals;IEEE
Digital Twins Driving Model Based on Petri Net in Industrial Pipeline;Online simulation systems are mostly model-driven without considering about real-time interactive controlling with physical systems. In order to enhance the two-way interaction control capability of digital twins and physical systems, this paper proposes a digital twin-driven model based on Petri Net. It defines a state incremental update place for enhancing the ability of real-time simulation, and defines a feedback control structure to control the function of opening and closing the real industrial pipelines. Taking the industrial parameters of the suit processing line as experimental data, the feasibility of online synchronization communication and feedback control of the digital twin driven model and the actual production line was verified.;2020 International Conference on Artificial Intelligence and Electromechanical Automation (AIEA);"Y. Dai; Y. Shi; Z. Zhang; R. Tao; F. Fang";2020;IEEE Conferences;IEEE
