Document Title;Abstract;Publication Title;Authors;Publication Year;Document Identifier;Publisher
Model-Driven Digital Twin Construction: Synthesizing the Integration of Cyber-Physical Systems with Their Information Systems;Digital twins emerge in many disciplines to support engineering, monitoring, controlling, and optimizing cyber-physical systems, such as airplanes, cars, factories, medical devices, or ships. There is an increasing demand to create digital twins as representation of cyber-physical systems and their related models, data traces, aggregated data, and services. Despite a plethora of digital twin applications, there are very few systematic methods to facilitate the modeling of digital twins for a given cyber-physical system. Existing methods focus only on the construction of specific digital twin models and do not consider the integration of these models with the observed cyber-physical system. To mitigate this, we present a fully model-driven method to describe the software of the cyber-physical system, its digital twin information system, and their integration. The integration method relies on MontiArc models of the cyber-physical system's architecture and on UML/P class diagrams from which the digital twin information system is generated. We show the practical application and feasibility of our method on an IoT case study. Explicitly modeling the integration of digital twins and cyber-physical systems eliminates repetitive programming activities and can foster the systematic engineering of digital twins.;Proceedings of the 23rd ACM/IEEE International Conference on Model Driven Engineering Languages and Systems;Kirchhof JC,Michael J,Rumpe B,Varga S,Wortmann A;2020;Conference Paper;ACM
Measuring the Fidelity of Digital Twin Systems;A digital twin is a virtual replica of a system at a certain level of fidelity, synchronized at a specific frequency. Digital twins often replicate physical systems whose simulations are usually computationally costly. One of the solutions to this problem proposed in the literature is to define a hierarchy of multi-fidelity digital twins, where we use one twin or another depending on the specific purpose. However, one of the challenges of this proposal is the need to determine whether the different twins are equivalent to each other and the physical system. In this thesis, we explore different methods to measure this equivalence by analyzing the state and behavior of the twins with the aid of high-level software models.;Proceedings of the 25th International Conference on Model Driven Engineering Languages and Systems: Companion Proceedings;Muñoz P;2022;Conference Paper;ACM
Digital Twin as Risk-Free Experimentation Aid for Techno-Socio-Economic Systems;Environmental uncertainties and hyperconnectivity force technosocio-economic systems to introspect and adapt to succeed and survive. Current practices in decision-making are predominantly intuition-driven with attendant challenges for precision and rigor. We propose to use the concept of digital twins by combining results from Modelling & Simulation, Artificial Intelligence, and Control Theory to create a risk free 'in silico' experimentation aid to help: (i) understand why a system is the way it is, (ii) be prepared for possible outlier conditions, and (iii) identify plausible solutions for mitigating the outlier conditions in an evidence-backed manner. We use reinforcement learning to systematically explore the digital twin solution space. Our proposal is significant because it advances the effective use of digital twins to new problem domains that have new potential for impact. Our approach contributes an original meta model for simulatable digital twin of industry scale techno-socioeconomic systems, agent-based implementation of the digital twin, and an architecture that serves as a risk-free experimentation aid to support simulation-based evidence-backed decision-making. We also discuss the rigor of our validation of the proposed approach and associated technology infrastructure through a representative sample of industry-scale real-world use cases.;Proceedings of the 25th International Conference on Model Driven Engineering Languages and Systems;Barat S,Kulkarni V,Clark T,Barn B;2022;Conference Paper;ACM
Using Trace Alignments for Measuring the Similarity between a Physical and Its Digital Twin;A common problem in the development of digital twin systems is the validation that the behavior of both twins, the physical and the digital, is the same, or at least similar enough given the requirements of the digital twin system. In this paper, we propose a method for the alignment of the traces of both twins. Traces are sequences of snapshots that capture the progressive states of each entity. Our approach is based on a bioinformatic algorithm that we adapt and use for the alignment of snapshots. Additionally, we include a set of measures to evaluate the quality of these alignments and reason about the level of fidelity of the digital twin system. Two case studies are used to demonstrate our proposal and evaluate its accuracy and effectiveness.;Proceedings of the 25th International Conference on Model Driven Engineering Languages and Systems: Companion Proceedings;Muñoz P,Wimmer M,Troya J,Vallecillo A;2022;Conference Paper;ACM
Towards a Digital Twin for Cyber-Physical Production Systems: A Multi-Paradigm Modeling Approach in the Postal Industry;This paper presents our early-stage research on a Multi-Paradigm Modeling (MPM) approach as an initial step towards the definition of a Digital Twin (DT) for Cyber-Physical Production Systems (CPPSs). This work takes place in the context of the digitalization of the mail sorting process at La Poste, the French national postal service company. Indeed, La Poste is currently investing on robotics modules for automatically loading mail containers. The main objective is to reduce the painful work for human operators while optimizing the robots usage. We already worked on targeting such a balance in a past effort that resulted in the production of different kinds of models of the La Poste CPPS. However, these models were defined separately and are not directly related to the underlying business process in particular. Thus, we propose an MPM approach starting from this business process as now modeled explicitly in a BPMN model. Then, we refine the high-level business activities into finer-grained activities represented in a UML Activity model. From these latest, we derive the specification of a Multi-Agent System (MAS) developed with the JADE framework and emulating the behavior of the La Poste CPPS. Our longer term objective is to pave the way for supporting the definition of a DT for this CPPS, and potentially for other CPPSs in different contexts in the future.;Proceedings of the 23rd ACM/IEEE International Conference on Model Driven Engineering Languages and Systems: Companion Proceedings;Niati A,Selma C,Tamzalit D,Bruneliere H,Mebarki N,Cardin O;2020;Conference Paper;ACM
A Novel Methodology to Construct Digital Twin Models for Spacecraft Operations Using Fault and Behaviour Trees;Successful satellite data reception requires the nominal operation of the ground stations in charge of their health monitoring as much as the spacecrafts themselves. Although the concept of Model-Based Diagnosis (MBD) in the field of autonomous systems -such as satellites, has long been researched and developed, that is not the case for their ground systems. Both satellites and ground stations operate autonomously. The latter however, are not equipped with the advanced Fault Detection, Isolation and Recovery (FDIR) capabilities one finds today on-board all orbiting spacecrafts. The aim of the study presented in this paper is the improvement of ground stations' operational diagnostics by providing the operators with ad-hock, Operations-Dedicated Models (ODMs). The latter serve as a basis for the construction of the system's Digital Twin (DT) models. These models allow the operators react more quickly and more precisely to alarms raised by the station. By helping the operators identify the malfunction and correct it in the quickest delays, they can avoid loosing the next satellite telemetry (TM) data, thus saving precious time and costs. This would increase both the availability and maintainability of the system. In a larger framework, ODMs are ideally concurrently built and connected with the engineering and safety models of the system, in a sort of virtual continuous improvement loop. While the utter purpose of ODMs is their usage as the system's DTs during operations, they also contribute to the stations' architecture and robustness continuous improvement, through increasing its fault detection and mitigation capabilities.;Proceedings of the 25th International Conference on Model Driven Engineering Languages and Systems: Companion Proceedings;Christofi N,Pucel X;2022;Conference Paper;ACM
Understanding and Improving Model-Driven IoT Systems through Accompanying Digital Twins;Developers questioning why their system behaves differently than expected often have to rely on time-consuming and error-prone manual analysis of log files. Understanding the behavior of Internet of Things (IoT) applications is a challenging task because they are not only inherently hard-to-trace distributed systems, but their integration with the environment via sensors adds another layer of complexity. Related work proposes to record data during the execution of the system, which can later be replayed to analyze the system. We apply the model-driven development approach to this idea and leverage digital twins to collect the required data. We enable developers to replay and analyze the system’s executions by applying model-to-model transformations. These transformations instrument component and connector (C&C) architecture models with components that reproduce the system’s environment based on the data recorded by the system’s digital twin. We validate and evaluate the feasibility of our approach using a heating, ventilation, and air conditioning (HVAC) case study. By facilitating the reproduction of the system’s behavior, our method lowers the barrier to understanding the behavior of model-driven IoT systems.;Proceedings of the 20th ACM SIGPLAN International Conference on Generative Programming: Concepts and Experiences;Kirchhof JC,Malcher L,Rumpe B;2021;Conference Paper;ACM
CPSAML: A Language and Code Generation Framework for Digital Twin Based Monitoring of Mobile Cyber-Physical Systems;Cyber-physical systems (CPS) are finding increasing use, whether in factories, autonomous vehicles, or smart buildings. Monitoring the execution of CPSs is crucial since CPSs directly influence their physical environment. Like the actual system, the monitoring application must be designed, developed, and tested. Mobile CPSs, in contrast to stationary CPSs, bring the additional requirement that instances can dynamically join, leave, or fail during execution time. This dynamic behavior must also be considered in the monitoring application. This paper presents CPSAML, a language and code generation framework for the model-driven development of mobile CPS systems, including a cockpit application for monitoring and interacting with such a system. The pipeline starts with the formulation of the system and the CPSs it contains at an abstract level by the system architect using a domain-specific modeling language. Next, this model is transformed into SysML 2 for further extension and richer specificity by system engineers on a more technical level. In the last step of the pipeline, the SysML 2 model is used to generate code for the CPS devices, a system-wide digital twin, and the cockpit application mentioned above. This cockpit enables the operator to configure and apply the monitoring and interaction with the system during runtime. We evaluate our CPSAML language and code generation framework on an Indoor Transport System case study with Roomba vacuum cleaner robots.;Proceedings of the 25th International Conference on Model Driven Engineering Languages and Systems: Companion Proceedings;Fend A,Bork D;2022;Conference Paper;ACM
On the Engineering of IoT-Intensive Digital Twin Software Systems;Digital Twins (DT) are software systems representing different aspects of a physical or conceptual counterpart---the real twin, which is instrumented with several sensors or computing devices that generate, consume and transfer data to its DT with different purposes. In other words, DT systems are, to a large extent, IoT-intensive systems. Indeed, by exploiting and managing IoT data, artificial intelligence, and big data and simulation capabilities, DTs have emerged as a promising approach to manage the virtual manifestation of real-world entities throughout their entire lifecycle. Their proliferation will contribute to realizing the long-craved convergence of virtual and physical spaces to augment things and human capabilities. In this context, despite the proposal of noteworthy contributions, we argue that DTs have not been sufficiently investigated from a software engineering perspective. To address this, in this paper we propose GEMINIS, an architectural reference model that adopts self-adaptation, control, and model-driven engineering techniques to specify the structural and behavioural aspects of DTs and enable the evolution of their internal models. Moreover, we introduce an approach for engineering IoT-intensive Digital Twin Software Systems (DTSS) using GEMINIS' capabilities to deal with uncertain conditions that are inherent to the nature of mirrored physical environments and that might compromise the fidelity of a DT. With GEMINIS and the proposed approach, we aim to advance the engineering of DTSS as well as IoT and cyber-physical systems by providing practitioners with guidelines to model and specify inherent structural and behavioural characteristics of DTs, addressing common design concerns.;Proceedings of the IEEE/ACM 42nd International Conference on Software Engineering Workshops;Rivera LF,Müller HA,Villegas NM,Tamura G,Jiménez M;2020;Conference Paper;ACM
A Flexible and Modular Architecture for Edge Digital Twin: Implementation and Evaluation;IoT systems based on Digital Twins (DTs) — virtual copies of physical objects and systems — can be very effective to enable data-driven services and promote better control and decisions, in particular by exploiting distributed approaches where cloud and edge computing cooperate effectively. In this context, digital twins deployed on the edge represents a new strategic element to design a new wave of distributed cyber-physical applications. Existing approaches are generally focused on fragmented and domain-specific monolithic solutions and are mainly associated to model-driven, simulative or descriptive visions. The idea of extending the DTs role to support last-mile digitalization and interoperability through a set of general purpose and well-defined properties and capabilities is still underinvestigated. In this paper, we present the novel Edge Digital Twins (EDT) architectural model and its implementation, enabling the lightweight replication of physical devices providing an efficient digital abstraction layer to support the autonomous and standard collaboration of things and services. We model the core capabilities with respect to the recent definition of the state of the art, present the software architecture and a prototype implementation. Extensive experimental analysis shows the obtained performance in multiple IoT application contexts and compares them with that of state-of-the-art approaches.;ACM Trans. Internet Things;Picone M,Mamei M,Zambonelli F;2023;Journal Article;ACM
Enabling Semantic Interoperability of Asset Administration Shells through an Ontology-Based Modeling Method;Digital twin technology establishes the future development vision for Industry 4.0, and is also an important exploration direction for the Model-Driven Engineering (MDE) paradigm. Because it builds a more flexible and communicative production system through models that spans life cycle, hierarchy and architecture. The standard proposed under the concept of Industry 4.0, the Asset Administration Shell (AAS), provides a syntactic interoperability interface for all assets involved in smart factories. However, there is still a need to fill the gap regarding semantic interoperability, in order to allow efficient interactions between Industry 4.0 components. Ontologies are a good candidate because they provide formal semantics expressed using a knowledge representation language, and in addition, there are many associated mature tools for reasoning and inference. Therefore, we propose a modeling approach that provides semantic interoperability for AAS-based digital twins using ontologies.;Proceedings of the 25th International Conference on Model Driven Engineering Languages and Systems: Companion Proceedings;Huang Y,Dhouib S,Medinacelli LP,Malenfant J;2022;Conference Paper;ACM
Challenges and Possible Approaches for Sustainable Digital Twinning;The advance in digital twin technology is creating value for lots of companies. We look at the digital twin design and operation from a sustainability perspective. We identify some challenges related to a digital twin's sustainable design and operation. Finally, we look at some possible approaches, grounded in multi-paradigm modelling to help us create and deploy more sustainable twins.;Proceedings of the 25th International Conference on Model Driven Engineering Languages and Systems: Companion Proceedings;Bellis S,Denil J;2022;Conference Paper;ACM
Coordination and Explanation of Reconfigurations in Self-Adaptive High-Performance Systems;Self-adaptive systems that modify their architecture to achieve different Service Level Objectives (SLOs) are becoming well-established parts of a company's portfolio. Current systems however do a poor job of coordinating the underlying rules and explaining the system's behavior to developers. This negatively impacts a system's performance due to behaving in unintended and hard-to-comprehend ways.In this vision paper, we introduce an approach that intends to alleviate these problems, for the use-case of high-performance cloud clusters, through the use of a cyber-cyber digital twin based on the Palladio ecosystem. The conceived digital twin allows for several functions that are unexplored in literature so far: the combination of design time analysis with explainability, use of state-space prediction bounded by likelihood, and explanation of non-applicability. This is achieved through a digital twin performing three main activities:1) The predicting activity predicts system performance along several potential paths.2) The planning activity analyzes reconfiguration rules and predicted system behavior to produce reconfiguration plans that try to optimally utilize available resources and achieve all SLOs without unintended interactions between the execution of rules.3) The explaining activity processes all artifacts produced during system simulation time or runtime to provide comprehensive visualizations to developers.We explain how each activity is performed and what models it processes and produces based on a running example.;Proceedings of the 25th International Conference on Model Driven Engineering Languages and Systems: Companion Proceedings;Stieß S,Becker S,Ege F,Höppner S,Tichy M;2022;Conference Paper;ACM
Case Study on Automated and Continuous Reliability Assessment of Software-Defined Manufacturing Based on Digital Twins;Traditional production systems are characterized by rare software updates and fixed production lines. Each production unit is designed and programmed for a specific task. Therefore, the reliability assessment is conducted once before the operation, mostly manually, and is based on traditional reliability models, such as event trees, fault trees, or reliability block diagrams. In comparison to traditional production systems, the focus of modern, complex production systems is shifted towards the software part. This is emphasized by the concepts of digital twins and Software-Defined Manufacturing (SDM). These software-intensive and safety-critical systems have more frequent software updates to address higher system flexibility and adjustable production processes. Therefore, SDM systems require a new approach to reliability assessment. Each software update can change the system behavior significantly. This leads to the necessity to reconduct the reliability assessment automatically before each software update. Advanced and hybrid reliability models are the key enabling technology. These models must be automatically generated and synchronized with the available system models and digital twins. Model-to-Model (M2M) transformation methods are another enabling technology.In this paper, we present a case study on automated and continuous reliability assessment of SDM. It shows, that our new method is a suitable candidate to enable the reliability assessment of SDM based on digital twins. The method includes (i) the extension of SysML v2 for reliability assessment, (ii) the automatic generation of hybrid reliability models from the digital twin, and (iii) their reliability assessment with new solvers developed for our OpenPRA framework.;Proceedings of the 25th International Conference on Model Driven Engineering Languages and Systems: Companion Proceedings;Grimmeisen P,Wortmann A,Morozov A;2022;Conference Paper;ACM
Integration of SysML Models in a 3D Environment for Virtual Testing and Validation;Model–Driven Systems Engineering has been presented as a promising approach for developing complex systems. To address the complexity of systems, it is necessary to ensure that knowledge is transferred properly between projects, teams, and engineers. To avoid specification omissions and misinterpretations to surface in projects, clear communication is needed during the system’s development. The introduction of SysML and systems modeling was intended to improve the communication of design intent among stakeholders and engineers. System models have multiple diagrams that are all interconnected and interrelated, such that they represent a consistent view of a system. To comprehend the structure and the behavior of a complex system, proper visualization of the SysML models is needed. There are mature commercial tools that offers support to SysML modeling, and forming the major platforms for developing the SysML models. However, the current SysML modeling tools use 2-dimensional views to visualize the models, which limits the comprehension of a complex system. To overcome this limitation, the SysML models have to integrate into a 3D virtual environment. In this paper, we present the first step towards this solution by introducing the architecture and the implementation of a conversion layer, that converts a SysML model to a 3D representation. To validate the conversion layer a prototype is presented, which converts a SysML model developed with IBM Rhapsody into a 3D representation in the Unity Game Engine. The performed test showed that the complexity of the models can be comprehended more efficiently in 3D than in a 2D environment. Moreover, visualizing the SysML models in 3D offers a better understanding and insight into the structure and the behavior of a system. Coupling the 3D representation of the SysML models with the 3D CAD representation of the modeled system, as in the Digital Twin case, offers new ways of capturing the design of a complex system.;Proceedings of the Federated Africa and Middle East Conference on Software Engineering;Barosan I,van der Heijden J;2022;Conference Paper;ACM
Semantic digital twins for organizational development;Semantic-based Digital Twins can be applied to the enactment of the digital counterparts of enterprises and organizations, and not only for physical devices or machines. Digital Twins for Organizations have a profound impact in the architecture of corporate management platforms, in the design of business processes and in the conception of information and technological ecosystems.. This work condenses our experience in the creation of Digital Twins for Organizations, using model-driven engineering based on semantic modeling. We will describe their more relevant characterizations and discuss their potential impact in their business implementations. Copyright © 2021 for this paper by its authors.;CEUR Workshop Proceedings;"Diéz A.; De Lara J.";2021;Conference paper;CEUR-WS
